{"style": "linear_ramp", "iteration": 0, "drift": 0.0, "regime": "calm", "model": "claude-opus-4-8", "candidate": {"type": "index", "params": {"table": "title", "columns": ["production_year"]}, "reversible": true}, "proposer_reasoning": "The slow SELECT seq-scans title filtering on production_year; a B-tree index on that column directly serves the BETWEEN range predicate. It's targeted, reversible, and exactly matches this calm, read-heavy regime.", "pore": "auto_safe", "risk_level": "low", "escalated": false, "human_judge": null, "human_decision": null, "human_rationale": null, "baseline_p99": 66.324, "candidate_p99": 66.324, "within_noise": false, "decision": "keep", "proposer_tokens": {"input_tokens": 1488, "output_tokens": 196}, "human_tokens": {}}
{"style": "linear_ramp", "iteration": 1, "drift": 0.0526, "regime": "calm", "model": "claude-opus-4-8", "candidate": {"type": "index", "params": {"table": "cast_info", "columns": ["movie_id"]}, "reversible": true}, "proposer_reasoning": "cast_info has ~300k rows and no secondary indexes; its movie_id join column is the most likely remaining seq-scan bottleneck for the read-heavy OLTP joins now that title.production_year is already indexed. A targeted, reversible index on the hottest join column fits this calm regime.", "pore": "auto_safe", "risk_level": "low", "escalated": false, "human_judge": null, "human_decision": null, "human_rationale": null, "baseline_p99": 42.061, "candidate_p99": 42.061, "within_noise": false, "decision": "keep", "proposer_tokens": {"input_tokens": 1524, "output_tokens": 221}, "human_tokens": {}}
{"style": "linear_ramp", "iteration": 2, "drift": 0.1053, "regime": "calm", "model": "claude-opus-4-8", "candidate": {"type": "index", "params": {"table": "cast_info", "columns": ["person_id"]}, "reversible": true}, "proposer_reasoning": "In this calm, read-heavy regime the remaining unindexed join column on the largest table is cast_info.person_id; an index here accelerates person-based joins/lookups against name without any risk, and the title.production_year and cast_info.movie_id indexes are already in place.", "pore": "auto_safe", "risk_level": "low", "escalated": false, "human_judge": null, "human_decision": null, "human_rationale": null, "baseline_p99": 25.906, "candidate_p99": 25.906, "within_noise": false, "decision": "keep", "proposer_tokens": {"input_tokens": 1551, "output_tokens": 205}, "human_tokens": {}}
{"style": "linear_ramp", "iteration": 3, "drift": 0.1579, "regime": "calm", "model": "claude-opus-4-8", "candidate": {"type": "index", "params": {"table": "movie_keyword", "columns": ["keyword_id", "movie_id"]}, "reversible": true}, "proposer_reasoning": "In a calm read-heavy OLTP regime, the remaining secondary-index gap is the movie_keyword join table: a composite index on (keyword_id, movie_id) supports keyword-filtered lookups and index-only joins back to title, without re-proposing the already-applied indexes. Fully reversible and targeted.", "pore": "auto_safe", "risk_level": "low", "escalated": false, "human_judge": null, "human_decision": null, "human_rationale": null, "baseline_p99": 16.478, "candidate_p99": 16.478, "within_noise": false, "decision": "keep", "proposer_tokens": {"input_tokens": 1577, "output_tokens": 233}, "human_tokens": {}}
{"style": "linear_ramp", "iteration": 4, "drift": 0.2105, "regime": "calm", "model": "claude-opus-4-8", "candidate": {"type": "index", "params": {"table": "cast_info", "columns": ["role_id"]}, "reversible": true}, "proposer_reasoning": "The title.production_year and core cast_info join columns are already indexed; the remaining unindexed filter column likely to cause seq scans on cast_info is role_id. A targeted secondary index on it is a reversible, low-risk fix appropriate for this calm, familiar read-heavy regime.", "pore": "auto_safe", "risk_level": "low", "escalated": false, "human_judge": null, "human_decision": null, "human_rationale": null, "baseline_p99": 10.511, "candidate_p99": 10.511, "within_noise": false, "decision": "keep", "proposer_tokens": {"input_tokens": 1614, "output_tokens": 213}, "human_tokens": {}}
{"style": "linear_ramp", "iteration": 5, "drift": 0.2632, "regime": "calm", "model": "claude-opus-4-8", "candidate": {"type": "index", "params": {"table": "movie_keyword", "columns": ["movie_id", "keyword_id"]}, "reversible": true}, "proposer_reasoning": "The existing movie_keyword index leads with keyword_id, so joins/filters that start from title.movie_id (very common in this read-heavy OLTP) still seq-scan; a (movie_id, keyword_id) index gives an index-only path for those access patterns, and it's a small reversible fix appropriate for this calm regime.", "pore": "auto_safe", "risk_level": "low", "escalated": false, "human_judge": null, "human_decision": null, "human_rationale": null, "baseline_p99": 7.513, "candidate_p99": 7.513, "within_noise": false, "decision": "keep", "proposer_tokens": {"input_tokens": 1640, "output_tokens": 240}, "human_tokens": {}}
{"style": "linear_ramp", "iteration": 6, "drift": 0.3158, "regime": "shifting", "model": "claude-opus-4-8", "candidate": {"type": "statistics", "params": {"table": "title", "columns": ["production_year", "kind_id"]}, "reversible": true}, "proposer_reasoning": "The join indexes already exist; the real defect is the bad row-count estimate driving plan flips. The filter on title's correlated columns (production_year/kind_id) yields skewed selectivity that the planner mis-estimates, so extended multi-column statistics gives it the dependency/ndistinct info to pick a stable plan without any irreversible or systemic risk.", "pore": "auto_safe", "risk_level": "low", "escalated": false, "human_judge": null, "human_decision": null, "human_rationale": null, "baseline_p99": 7.513, "candidate_p99": 7.34, "within_noise": true, "decision": "discard", "proposer_tokens": {"input_tokens": 1720, "output_tokens": 248}, "human_tokens": {}}
{"style": "linear_ramp", "iteration": 7, "drift": 0.3684, "regime": "shifting", "model": "claude-opus-4-8", "candidate": {"type": "statistics", "params": {"table": "title", "columns": ["production_year", "kind_id"]}, "reversible": true}, "proposer_reasoning": "The core symptom is bad row-count estimates and plan flips on title filtered by correlated columns; the join indexes already exist, so the missing lever is correct cardinality. Extended statistics on the correlated production_year/kind_id columns gives the planner accurate selectivity, stabilizing the join order and aggregation plan without any irreversible or systemic change.", "pore": "auto_safe", "risk_level": "low", "escalated": false, "human_judge": null, "human_decision": null, "human_rationale": null, "baseline_p99": 7.513, "candidate_p99": 7.464, "within_noise": true, "decision": "discard", "proposer_tokens": {"input_tokens": 1720, "output_tokens": 240}, "human_tokens": {}}
{"style": "linear_ramp", "iteration": 8, "drift": 0.4211, "regime": "shifting", "model": "claude-opus-4-8", "candidate": {"type": "statistics", "params": {"table": "title", "columns": ["production_year", "kind_id"]}, "reversible": true}, "proposer_reasoning": "The drift regime's core pain is bad row-count estimates on correlated filters causing plan flips; the relevant indexes already exist, so the missing lever is estimation quality. Extended statistics over the correlated columns on title fixes the cardinality misestimate feeding the join, stabilizing the planner's choice without reshaping any session behaviour or data semantics.", "pore": "auto_safe", "risk_level": "low", "escalated": false, "human_judge": null, "human_decision": null, "human_rationale": null, "baseline_p99": 7.513, "candidate_p99": 6.929, "within_noise": true, "decision": "discard", "proposer_tokens": {"input_tokens": 1720, "output_tokens": 241}, "human_tokens": {}}
{"style": "linear_ramp", "iteration": 9, "drift": 0.4737, "regime": "shifting", "model": "claude-opus-4-8", "candidate": {"type": "statistics", "params": {"table": "title", "columns": ["production_year", "kind_id"]}, "reversible": true}, "proposer_reasoning": "The core symptom is bad row-count estimates on correlated filters causing plan flips; the join indexes already exist, so adding extended (MCV/dependency) statistics on the correlated columns gives the planner accurate selectivity, fixing the estimate that drives the right join/aggregation plan in this drifting mixed workload.", "pore": "auto_safe", "risk_level": "low", "escalated": false, "human_judge": null, "human_decision": null, "human_rationale": null, "baseline_p99": 7.513, "candidate_p99": 7.245, "within_noise": true, "decision": "discard", "proposer_tokens": {"input_tokens": 1720, "output_tokens": 229}, "human_tokens": {}}
{"style": "linear_ramp", "iteration": 10, "drift": 0.5263, "regime": "shifting", "model": "claude-opus-4-8", "candidate": {"type": "statistics", "params": {"table": "title", "columns": ["production_year", "kind_id"]}, "reversible": true}, "proposer_reasoning": "The relevant join indexes already exist; the actual pain is the bad row-count estimate on title's correlated filter columns, which causes plan flips between nested-loop and hash join as analytical scans appear. Extended statistics correct the cardinality estimate at its source, stabilizing planner choices without reshaping execution behavior.", "pore": "auto_safe", "risk_level": "low", "escalated": false, "human_judge": null, "human_decision": null, "human_rationale": null, "baseline_p99": 7.513, "candidate_p99": 7.651, "within_noise": true, "decision": "rollback", "proposer_tokens": {"input_tokens": 1720, "output_tokens": 229}, "human_tokens": {}}
{"style": "linear_ramp", "iteration": 11, "drift": 0.5789, "regime": "shifting", "model": "claude-opus-4-8", "candidate": {"type": "statistics", "params": {"table": "title", "columns": ["production_year", "kind_id"]}, "reversible": true}, "proposer_reasoning": "The relevant join indexes already exist; the actual failure here is bad row-count estimation on correlated title columns driving plan flips. Extended (MCV + dependency) statistics over production_year and the correlated kind_id corrects the cardinality estimate the planner uses for the range filter, stabilizing join order and aggregation plans without reshaping data semantics.", "pore": "auto_safe", "risk_level": "low", "escalated": false, "human_judge": null, "human_decision": null, "human_rationale": null, "baseline_p99": 7.513, "candidate_p99": 7.34, "within_noise": true, "decision": "discard", "proposer_tokens": {"input_tokens": 1720, "output_tokens": 247}, "human_tokens": {}}
{"style": "linear_ramp", "iteration": 12, "drift": 0.6316, "regime": "turbulent", "model": "claude-opus-4-8", "candidate": {"type": "guc", "params": {"name": "work_mem", "value": "256MB"}, "reversible": true}, "proposer_reasoning": "Hash joins on the 5-table join are spilling to disk, which is the dominant p99 driver here; single-column indexes are exhausted. Raising work_mem lets the hash tables stay in memory, eliminating spill and stabilizing plan choice without reshaping data semantics. It is cleanly reversible and far less disruptive than bouncing shared_buffers/max_connections.", "pore": "auto_safe", "risk_level": "low", "escalated": false, "human_judge": null, "human_decision": null, "human_rationale": null, "baseline_p99": 6.497, "candidate_p99": 6.497, "within_noise": false, "decision": "keep", "proposer_tokens": {"input_tokens": 1725, "output_tokens": 242}, "human_tokens": {}}
{"style": "linear_ramp", "iteration": 13, "drift": 0.6842, "regime": "turbulent", "model": "claude-opus-4-8", "candidate": {"type": "guc", "params": {"name": "max_connections", "value": "100", "blast_radius": "high"}, "reversible": false}, "proposer_reasoning": "The symptoms — connection churn, hash spills despite work_mem=256MB, and plan flips under concurrent writes — point to memory contention from too many concurrent sessions each grabbing large work_mem allocations; bounding max_connections (paired with pooling) caps aggregate working memory so hash joins stop spilling and p99 stabilizes. Single-column indexes and per-query stats are exhausted, so a systemic memory/concurrency lever is the right regime-level fix.", "pore": "reversibility", "risk_level": "high", "escalated": true, "human_judge": "claude-sonnet-4-6", "human_decision": "reject", "human_rationale": "Rejecting this change. The proposal is to set max_connections=100, which in a turbulent regime (drift=0.68) with active write-heavy bursts and connection churn is almost certainly a reduction from the current value — and that makes it acutely dangerous right now. Here is the full audit trail: (1) Irreversibility: changing max_connections requires a PostgreSQL restart to take effect; there is no online rollback path, making this a hard-to-undo, service-impacting operation. (2) Blast radius: rated HIGH by the optimizer itself. Dropping the connection ceiling during a period of connection churn could immediately cause connection refusals for application threads, cascading into user-facing errors and potential application-layer retry storms that worsen the write-heavy load profile. (3) Regime fit: drift=0.68 means our workload model has significant uncertainty — we do not have a stable baseline to predict how many connections are actually needed. Acting on a high-irreversibility, high-blast-radius GUC change while the system is in flux violates the principle of minimizing irreversible interventions under uncertainty. (4) Diagnostic alignment: the stated culprits are memory pressure and planner misconfiguration driving plan regressions on multi-table joins. max_connections is a capacity ceiling, not a memory-management or planner knob — this change does not directly address the diagnosed root causes. If the intent is to reduce memory pressure by capping connections, the safer first steps are work_mem reduction, pgbouncer/pooler tuning (fully reversible, no restart), or setting idle connection timeouts — all of which can be tested and rolled back without a restart. This proposal should be resubmitted only after the regime stabilizes, with a confirmed current connection utilization baseline and a pooler-first strategy exhausted.", "baseline_p99": null, "candidate_p99": null, "within_noise": null, "decision": "escalated", "proposer_tokens": {"input_tokens": 1750, "output_tokens": 282}, "human_tokens": {"input_tokens": 987, "output_tokens": 456}}
{"style": "linear_ramp", "iteration": 14, "drift": 0.7368, "regime": "turbulent", "model": "claude-opus-4-8", "candidate": {"type": "guc", "params": {"name": "join_collapse_limit", "value": "1"}, "reversible": true}, "proposer_reasoning": "The core pain is plan flips on the 5-table join, not raw index coverage. With work_mem already at 256MB and single-column indexes exhausted, the instability is planner-driven. Setting join_collapse_limit=1 forces the planner to honor the written join order, eliminating the run-to-run plan regressions and hash-join spills caused by reordering under turbulent stats — without bouncing the service or touching every session's memory like shared_buffers would.", "pore": "auto_safe", "risk_level": "low", "escalated": false, "human_judge": null, "human_decision": null, "human_rationale": null, "baseline_p99": 5.604, "candidate_p99": 5.604, "within_noise": false, "decision": "keep", "proposer_tokens": {"input_tokens": 1840, "output_tokens": 265}, "human_tokens": {}}
{"style": "linear_ramp", "iteration": 15, "drift": 0.7895, "regime": "turbulent", "model": "claude-opus-4-8", "candidate": {"type": "guc", "params": {"name": "effective_cache_size", "value": "12GB", "blast_radius": "high"}, "reversible": true}, "proposer_reasoning": "The plan flips on the 5-table join under memory pressure point at the planner mis-costing index-nested-loop vs hash paths; a realistic effective_cache_size makes the planner favor stable index-driven joins over hash joins that are spilling, and it's a pure planner hint that reshapes costing for every session but is cleanly reversible without bouncing the service.", "pore": "blast_radius", "risk_level": "high", "escalated": true, "human_judge": "claude-sonnet-4-6", "human_decision": "approve", "human_rationale": "This is a GUC (Grand Unified Configuration) change to `effective_cache_size`, which is a **planner-only hint** — it does not allocate memory, it does not change buffer pool behavior, and it is fully reversible at any time with a single `SET` or `ALTER SYSTEM` command followed by a `pg_reload_conf()`, with no restart required. The proposed value of 12GB is a reasonable signal to the query planner that a substantial OS page cache is available, which directly addresses the reported plan regressions on multi-table joins: an underestimated `effective_cache_size` biases the planner toward nested-loop and seq-scan plans over index scans and merge joins, which is consistent with the observed p99 stagnation under write-heavy, connection-churn conditions. The blast radius is flagged as high because planner behavior is systemic — every query plan is affected — but the risk profile is asymmetric: if the value is wrong, rolling it back is instantaneous and zero-downtime. Drift is elevated (0.79), which warrants caution, but the change is coherent with the described symptom pattern (plan regressions, memory pressure, multi-table join degradation) and the parameter is well-understood. The expected win — steering the planner toward index-friendly plans during the burst regime — is a textbook first response to this class of regression. Approving with the recommendation that the on-call engineer monitors `pg_stat_statements` p99 latency and EXPLAIN plans on the regressed queries within 15 minutes post-change to confirm improvement, and reverts immediately if new plan shapes introduce worse regressions.", "baseline_p99": null, "candidate_p99": null, "within_noise": null, "decision": "escalated", "proposer_tokens": {"input_tokens": 1867, "output_tokens": 247}, "human_tokens": {"input_tokens": 991, "output_tokens": 421}}
{"style": "linear_ramp", "iteration": 16, "drift": 0.8421, "regime": "turbulent", "model": "claude-opus-4-8", "candidate": {"type": "guc", "params": {"name": "max_parallel_workers_per_gather", "value": "0", "blast_radius": "high"}, "reversible": true}, "proposer_reasoning": "Plan flips between runs on the 5-table join are a hallmark of parallel-plan instability under connection churn; with work_mem already at 256MB and hash joins spilling, disabling per-gather parallelism removes a major source of plan regression and per-session memory multiplication, stabilizing p99 without touching schema or data semantics. It is fully reversible and a different lever than the already-escalated max_connections/effective_cache_size.", "pore": "blast_radius", "risk_level": "high", "escalated": true, "human_judge": "claude-sonnet-4-6", "human_decision": "approve", "human_rationale": "Setting `max_parallel_workers_per_gather = 0` disables parallel query execution across the board. In the current turbulent regime (drift=0.84) characterized by write-heavy bursts, high connection churn, and active plan regressions on multi-table joins, parallel query is a credible aggravator: parallel workers compete for `max_worker_processes` slots, inflate memory consumption per query (each worker gets its own `work_mem` allocation), and can cause the planner to choose parallel-biased plans that regress under resource pressure. With single-column indexes no longer moving p99 and memory pressure identified as a plausible culprit, disabling parallelism is a well-established stabilization lever — it removes a significant source of plan variance and memory amplification without touching data or schema. Critically, this is a GUC change (fully reversible via `ALTER SYSTEM RESET` or a single config reload, no restart required in most Postgres versions), so the blast radius, while system-wide (all queries lose parallel execution), is immediately undoable if latency worsens rather than improves. The asymmetry favors approval: the expected win (reduced memory pressure, planner stability, fewer worker-slot exhaustion stalls) is meaningful and observable within minutes, and the rollback path is trivial. The high blast-radius flag is appropriate — this will affect every parallel-eligible query — but reversibility and the clear mechanistic justification in the current regime make this the right defensive call. Approve with the expectation that the on-call team monitors p99 and connection wait events for 15–30 minutes post-change and is ready to revert immediately if aggregate throughput degrades.", "baseline_p99": null, "candidate_p99": null, "within_noise": null, "decision": "escalated", "proposer_tokens": {"input_tokens": 1907, "output_tokens": 274}, "human_tokens": {"input_tokens": 994, "output_tokens": 425}}
