{"style": "oscillating", "iteration": 13, "drift": 0.8804, "regime": "regime_break", "model": "claude-opus-4-8", "candidate": {"type": "guc", "params": {"name": "max_wal_size", "value": "8GB", "blast_radius": "high"}, "reversible": true}, "proposer_reasoning": "The p99 oscillation correlates with the bulk-insert bursts interleaving with the join workload; the most likely systemic cause is checkpoint storms triggered by undersized WAL filling up under the insert load, stalling everything. Raising max_wal_size spreads checkpoints out, smoothing the 80ms->900ms swings, and it is cleanly reversible and does not touch durability or result semantics — strictly safer than the fsync/synchronous_commit and VACUUM FULL options already escalated.", "pore": "blast_radius", "risk_level": "high", "escalated": true, "human_judge": "claude-sonnet-4-6", "human_decision": "approve", "human_rationale": "This is a GUC (Grand Unified Configuration) change to `max_wal_size`, raising it to 8GB. Critically, this change is **reversible** — it can be reset at any time via `ALTER SYSTEM SET max_wal_size = <previous_value>; SELECT pg_reload_conf();` with no data loss or structural side effects. In a `regime_break` scenario with drift=0.88 and p99 latency spiking ~10x, the symptom profile is consistent with excessive WAL checkpoint pressure: when the workload is generating WAL faster than the current `max_wal_size` ceiling allows, PostgreSQL is forced into frequent, aggressive checkpoints that thrash I/O and cause the exact latency spikes described. Raising `max_wal_size` to 8GB reduces checkpoint frequency, smooths I/O, and gives the buffer manager more headroom to operate efficiently under an unprecedented write-heavy or mixed workload. The blast radius is legitimately flagged as high because a larger WAL window means more data to replay on crash recovery (potentially longer recovery time), and it increases disk space consumption. However, these are manageable and known trade-offs: recovery time increase is bounded and acceptable as a temporary measure, and disk space on modern systems is unlikely to be critically constrained at 8GB. The alternative — leaving p99 at 10x spike levels in an active incident — is the higher-risk outcome. Given that targeted indexes have already been tried and failed, and that this is a reversible tuning parameter with a clear, well-understood mechanism of action directly relevant to the observed symptoms, approval is the correct call. The on-call team should monitor checkpoint frequency (`pg_stat_bgwriter`), WAL generation rate, and disk utilization immediately after the change, and document the previous value for rollback readiness.", "baseline_p99": null, "candidate_p99": null, "within_noise": null, "decision": "escalated", "proposer_tokens": {"input_tokens": 1985, "output_tokens": 295}, "human_tokens": {"input_tokens": 993, "output_tokens": 459}}
{"style": "oscillating", "iteration": 14, "drift": 0.7351, "regime": "turbulent", "model": "claude-opus-4-8", "candidate": {"type": "guc", "params": {"name": "geqo", "value": "off"}, "reversible": true}, "proposer_reasoning": "Plan flips on the 5-table join under churn are the core pain; with join_collapse_limit already at 1 the join order is fixed, so disabling the genetic optimizer's stochastic search removes the remaining nondeterminism causing run-to-run plan regressions, and it's a cheap reversible planner knob rather than another exhausted index.", "pore": "auto_safe", "risk_level": "low", "escalated": false, "human_judge": null, "human_decision": null, "human_rationale": null, "baseline_p99": 16.745, "candidate_p99": 15.88, "within_noise": true, "decision": "discard", "proposer_tokens": {"input_tokens": 1950, "output_tokens": 225}, "human_tokens": {}}
{"style": "oscillating", "iteration": 15, "drift": 0.5, "regime": "shifting", "model": "claude-opus-4-8", "candidate": {"type": "index", "params": {"table": "cast_info", "columns": ["movie_id", "person_id"]}, "reversible": true}, "proposer_reasoning": "The join+aggregate on cast_info.movie_id over a production_year range is the hot path; a covering composite index on (movie_id, person_id) lets the planner do an index-only/index scan for the GROUP BY t.id aggregation, reducing heap fetches and stabilizing the plan against the row-count drift driving the flips. It's a cheap, fully reversible move that targets exactly the bad-estimate query without altering global session behaviour.", "pore": "auto_safe", "risk_level": "low", "escalated": false, "human_judge": null, "human_decision": null, "human_rationale": null, "baseline_p99": 12.389, "candidate_p99": 12.389, "within_noise": false, "decision": "keep", "proposer_tokens": {"input_tokens": 1945, "output_tokens": 269}, "human_tokens": {}}
{"style": "oscillating", "iteration": 16, "drift": 0.2649, "regime": "calm", "model": "claude-opus-4-8", "candidate": {"type": "index", "params": {"table": "cast_info", "columns": ["role_id"]}, "reversible": true}, "proposer_reasoning": "cast_info still has no secondary index on role_id, a common filter/join column in this JOB-style read-heavy workload; the production_year index already exists, so the next-best targeted, fully reversible win is covering the remaining unindexed filter column on the large cast_info table.", "pore": "auto_safe", "risk_level": "low", "escalated": false, "human_judge": null, "human_decision": null, "human_rationale": null, "baseline_p99": 8.794, "candidate_p99": 8.794, "within_noise": false, "decision": "keep", "proposer_tokens": {"input_tokens": 1935, "output_tokens": 210}, "human_tokens": {}}
{"style": "oscillating", "iteration": 17, "drift": 0.1196, "regime": "calm", "model": "claude-opus-4-8", "candidate": {"type": "index", "params": {"table": "cast_info", "columns": ["nr_order"]}, "reversible": true}, "proposer_reasoning": "The title.production_year index already exists, so the remaining unindexed secondary filter/join column is cast_info.nr_order; adding it is a targeted, reversible fix that fits this calm read-heavy regime without crossing any safety boundary.", "pore": "auto_safe", "risk_level": "low", "escalated": false, "human_judge": null, "human_decision": null, "human_rationale": null, "baseline_p99": 5.678, "candidate_p99": 5.678, "within_noise": false, "decision": "keep", "proposer_tokens": {"input_tokens": 1961, "output_tokens": 198}, "human_tokens": {}}
{"style": "oscillating", "iteration": 18, "drift": 0.1196, "regime": "calm", "model": "claude-opus-4-8", "candidate": {"type": "index", "params": {"table": "title", "columns": ["kind_id", "production_year"]}, "reversible": true}, "proposer_reasoning": "The single-column production_year index already exists; for the read-heavy OLTP joins that filter on title by year and frequently also constrain/join on kind_id, a composite index lets the planner satisfy both the range predicate and the kind_id join from one index, improving selectivity and avoiding heap fetches for the hot SELECTs. It's a targeted, fully reversible secondary index appropriate for this calm regime.", "pore": "auto_safe", "risk_level": "low", "escalated": false, "human_judge": null, "human_decision": null, "human_rationale": null, "baseline_p99": 3.64, "candidate_p99": 3.64, "within_noise": false, "decision": "keep", "proposer_tokens": {"input_tokens": 1988, "output_tokens": 254}, "human_tokens": {}}
{"style": "oscillating", "iteration": 19, "drift": 0.2649, "regime": "calm", "model": "claude-opus-4-8", "candidate": {"type": "index", "params": {"table": "title", "columns": ["kind_id"]}, "reversible": true}, "proposer_reasoning": "This is a calm, familiar read-heavy regime where a targeted reversible index is the right call. The production_year filter is already indexed; a single-column index on title.kind_id covers the remaining common join/filter path (title -> kind_type) not served by the existing composite (kind_id, production_year) when only kind_id is the predicate, and is cheap and cleanly droppable.", "pore": "auto_safe", "risk_level": "low", "escalated": false, "human_judge": null, "human_decision": null, "human_rationale": null, "baseline_p99": 2.623, "candidate_p99": 2.623, "within_noise": false, "decision": "keep", "proposer_tokens": {"input_tokens": 2018, "output_tokens": 237}, "human_tokens": {}}