{"style": "oscillating", "iteration": 13, "drift": 0.8804, "regime": "regime_break", "model": "claude-haiku-4-5", "candidate": {"type": "guc", "params": {"name": "max_parallel_workers_per_gather", "value": "4"}, "reversible": true}, "proposer_reasoning": "The regime is a mixed OLTP+OLAP storm with 10x p99 spike on a 5-table join workload. Enabling aggressive parallel query execution on the large join can collapse tail latency by distributing work across CPU cores, while remaining a safe, session-level tunable that won't destabilize durability or concurrent OLTP traffic.", "pore": "auto_safe", "risk_level": "low", "escalated": false, "human_judge": null, "human_decision": null, "human_rationale": null, "baseline_p99": 22.986, "candidate_p99": 21.065, "within_noise": true, "decision": "discard", "proposer_tokens": {"input_tokens": 1750, "output_tokens": 182}, "human_tokens": {}}
{"style": "oscillating", "iteration": 14, "drift": 0.7351, "regime": "turbulent", "model": "claude-haiku-4-5", "candidate": {"type": "statistics", "params": {"table": "cast_info", "columns": ["movie_id", "person_id", "role_id"]}, "reversible": true}, "proposer_reasoning": "Multi-table join plans are regressing under concurrent load because the planner lacks visibility into correlations between cast_info's key columns and role distributions. Extended statistics on the 3-column subset will stabilize join ordering and cardinality estimates across plan flips, reducing hash-join spills without touching memory or blast-radius GUCs.", "pore": "auto_safe", "risk_level": "low", "escalated": false, "human_judge": null, "human_decision": null, "human_rationale": null, "baseline_p99": 22.986, "candidate_p99": 22.754, "within_noise": true, "decision": "discard", "proposer_tokens": {"input_tokens": 1690, "output_tokens": 195}, "human_tokens": {}}
{"style": "oscillating", "iteration": 15, "drift": 0.5, "regime": "shifting", "model": "claude-haiku-4-5", "candidate": {"type": "statistics", "params": {"table": "cast_info", "columns": ["movie_id", "nr_order"]}, "reversible": true}, "proposer_reasoning": "The problem query joins title → cast_info on movie_id after filtering by production_year. Extended statistics on (movie_id, nr_order) in cast_info will help the planner understand the correlation between which movies appear in cast_info and their ordering patterns, improving row-count estimates for the join cardinality and reducing plan instability under workload drift.", "pore": "auto_safe", "risk_level": "low", "escalated": false, "human_judge": null, "human_decision": null, "human_rationale": null, "baseline_p99": 22.986, "candidate_p99": 21.563, "within_noise": true, "decision": "discard", "proposer_tokens": {"input_tokens": 1684, "output_tokens": 187}, "human_tokens": {}}
{"style": "oscillating", "iteration": 16, "drift": 0.2649, "regime": "calm", "model": "claude-haiku-4-5", "candidate": {"type": "index", "params": {"table": "movie_keyword", "columns": ["keyword_id", "movie_id"]}, "reversible": true}, "proposer_reasoning": "The workload is read-heavy OLTP with stable patterns. An index on (keyword_id, movie_id) complements the existing (movie_id, keyword_id) index, enabling efficient lookups when filtering by keyword first—a common pattern in OLTP queries that search/drill down by keyword attributes before joining to titles.", "pore": "auto_safe", "risk_level": "low", "escalated": false, "human_judge": null, "human_decision": null, "human_rationale": null, "baseline_p99": 15.797, "candidate_p99": 15.797, "within_noise": false, "decision": "keep", "proposer_tokens": {"input_tokens": 1650, "output_tokens": 175}, "human_tokens": {}}
{"style": "oscillating", "iteration": 17, "drift": 0.1196, "regime": "calm", "model": "claude-haiku-4-5", "candidate": {"type": "index", "params": {"table": "cast_info", "columns": ["person_id"]}, "reversible": true}, "proposer_reasoning": "The cast_info table has 300k rows with no secondary indexes except the recently added movie_id index. A secondary index on person_id will accelerate common name-to-cast lookups and join patterns, reducing seq scans and improving p99 latency for join-heavy OLTP workloads without blocking writes or schema changes.", "pore": "auto_safe", "risk_level": "low", "escalated": false, "human_judge": null, "human_decision": null, "human_rationale": null, "baseline_p99": 10.188, "candidate_p99": 10.188, "within_noise": false, "decision": "keep", "proposer_tokens": {"input_tokens": 1678, "output_tokens": 171}, "human_tokens": {}}
{"style": "oscillating", "iteration": 18, "drift": 0.1196, "regime": "calm", "model": "claude-haiku-4-5", "candidate": {"type": "index", "params": {"table": "title", "columns": ["production_year", "id"]}, "reversible": true}, "proposer_reasoning": "A covering index on (production_year, id) will enable index-only scans for the problematic SELECT * query on the production_year range, eliminating the heap lookups entirely. This is a natural next step after the single-column production_year index and is far more efficient than sequential scans or heap access.", "pore": "auto_safe", "risk_level": "low", "escalated": false, "human_judge": null, "human_decision": null, "human_rationale": null, "baseline_p99": 6.63, "candidate_p99": 6.63, "within_noise": false, "decision": "keep", "proposer_tokens": {"input_tokens": 1700, "output_tokens": 171}, "human_tokens": {}}
{"style": "oscillating", "iteration": 19, "drift": 0.2649, "regime": "calm", "model": "claude-haiku-4-5", "candidate": {"type": "index", "params": {"table": "title", "columns": ["production_year", "kind_id", "id"]}, "reversible": true}, "proposer_reasoning": "The problem query `SELECT * FROM title WHERE production_year BETWEEN 2000 AND 2010` can now execute an index-only scan or fast index range scan on this covering index. While a single-column index on `production_year` exists, adding `kind_id` and `id` as additional columns creates a composite covering index that allows the query planner to avoid heap lookups entirely and answers joins efficiently.", "pore": "auto_safe", "risk_level": "low", "escalated": false, "human_judge": null, "human_decision": null, "human_rationale": null, "baseline_p99": 4.508, "candidate_p99": 4.508, "within_noise": false, "decision": "keep", "proposer_tokens": {"input_tokens": 1724, "output_tokens": 194}, "human_tokens": {}}