{"style": "linear_ramp", "iteration": 0, "drift": 0.0, "regime": "calm", "model": "MiniMax-M3", "candidate": {"type": "index", "params": {"columns": {"item": "production_year"}, "table": "title"}, "reversible": true}, "proposer_reasoning": "Calm, read-heavy OLTP with a stable workload pattern. The seq scan on the range filter `production_year BETWEEN 2000 AND 2010` is the clear bottleneck; a single-column btree on production_year directly serves the predicate and is the minimal, fully reversible fix.", "pore": "auto_safe", "risk_level": "low", "escalated": false, "human_judge": null, "human_decision": null, "human_rationale": null, "baseline_p99": 68.601, "candidate_p99": 68.601, "within_noise": false, "decision": "keep", "proposer_tokens": {"input_tokens": 876, "output_tokens": 138}, "human_tokens": {}}
{"style": "linear_ramp", "iteration": 1, "drift": 0.0526, "regime": "calm", "model": "MiniMax-M3", "candidate": {"type": "statistics", "params": {"columns": ["production_year", "kind_id"], "table": "title"}, "reversible": true}, "proposer_reasoning": "The production_year index already exists but the planner still chooses seq scan, suggesting it misestimates the row count for the 11-year range — likely because predicates commonly co-occur with kind_id filtering. Extended statistics on this pair gives the planner a multivariate estimate so it can pick the index scan path. This is the lowest-risk reversible lever for a calm regime; if it doesn't flip the plan, the next iteration should consider a covering index on (production_year, kind_id) INCLUDE (title).", "pore": "auto_safe", "risk_level": "low", "escalated": false, "human_judge": null, "human_decision": null, "human_rationale": null, "baseline_p99": 64.958, "candidate_p99": 64.958, "within_noise": false, "decision": "keep", "proposer_tokens": {"input_tokens": 890, "output_tokens": 577}, "human_tokens": {}}
{"style": "linear_ramp", "iteration": 2, "drift": 0.1053, "regime": "calm", "model": "MiniMax-M3", "candidate": {"type": "index", "params": {"columns": {"item": "movie_id"}, "table": "cast_info"}, "reversible": true}, "proposer_reasoning": "The bottleneck is a seq scan on title filtered by production_year, but the larger anti-pattern in this schema is joining the 300k-row cast_info on movie_id with no supporting index. While the title/production_year index is already in place, the real p99 win on this IMDB-shaped workload comes from avoiding the nested-loop-on-heap pattern on cast_info. Adding a btree on cast_info(movie_id) is the canonical, reversible fix that unblocks efficient joins from title → cast_info → name.", "pore": "auto_safe", "risk_level": "low", "escalated": false, "human_judge": null, "human_decision": null, "human_rationale": null, "baseline_p99": 41.83, "candidate_p99": 41.83, "within_noise": false, "decision": "keep", "proposer_tokens": {"input_tokens": 283, "output_tokens": 184}, "human_tokens": {}}
{"style": "linear_ramp", "iteration": 3, "drift": 0.1579, "regime": "calm", "model": "MiniMax-M3", "candidate": {"type": "index", "params": {"columns": {"item": ["production_year", "kind_id"]}, "table": "title"}, "reversible": true}, "proposer_reasoning": "The single-column index on production_year alone forces the planner to do a range scan over many years and then filter/post-filter by kind_id (or vice versa, depending on selectivity). A composite (production_year, kind_id) index matches the actual query shape — range on production_year with an equality/filter on kind_id — and lets the planner use a single index scan with both predicates, which is the right shape for this kind of IMDB-style workload where most queries combine a year range with a kind filter. It's still fully reversible and small, but it's the targeted fix that actually addresses the correlated predicate pair rather than just one column.", "pore": "auto_safe", "risk_level": "low", "escalated": false, "human_judge": null, "human_decision": null, "human_rationale": null, "baseline_p99": 28.371, "candidate_p99": 28.371, "within_noise": false, "decision": "keep", "proposer_tokens": {"input_tokens": 302, "output_tokens": 217}, "human_tokens": {}}
{"style": "linear_ramp", "iteration": 4, "drift": 0.2105, "regime": "calm", "model": "MiniMax-M3", "candidate": {"type": "index", "params": {"columns": {"item": "production_year"}, "table": "title"}, "reversible": true}, "proposer_reasoning": "Workload is calm and read-heavy; a single-column btree on title(production_year) directly supports the BETWEEN range filter on the reported seq-scanning query. Fully reversible, low blast radius, and the simplest targeted fix.", "pore": "auto_safe", "risk_level": "low", "escalated": false, "human_judge": null, "human_decision": null, "human_rationale": null, "baseline_p99": 18.683, "candidate_p99": 18.683, "within_noise": false, "decision": "keep", "proposer_tokens": {"input_tokens": 325, "output_tokens": 126}, "human_tokens": {}}
{"style": "linear_ramp", "iteration": 5, "drift": 0.2632, "regime": "calm", "model": "MiniMax-M3", "candidate": {"type": "index", "params": {"columns": {"item": "person_id"}, "table": "cast_info"}, "reversible": true}, "proposer_reasoning": "cast_info is the largest table (~300k rows) and the join hub of the workload. movie_id is already indexed, but person_id joins to name are unindexed, forcing seq scans for person-centric queries. Adding a btree on person_id directly addresses the largest unindexed join column of the biggest table. Reversible, targeted, and the highest-leverage remaining fix in this regime.", "pore": "auto_safe", "risk_level": "low", "escalated": false, "human_judge": null, "human_decision": null, "human_rationale": null, "baseline_p99": 12.895, "candidate_p99": 12.895, "within_noise": false, "decision": "keep", "proposer_tokens": {"input_tokens": 343, "output_tokens": 541}, "human_tokens": {}}
{"style": "linear_ramp", "iteration": 6, "drift": 0.3158, "regime": "shifting", "model": "MiniMax-M3", "candidate": {"type": "statistics", "params": {"columns": {"item": ["production_year", "id"]}, "table": "title"}, "reversible": true}, "proposer_reasoning": "Bad row-count estimate on GROUP BY t.id after filtering on production_year indicates the planner thinks far fewer distinct t.id values survive the filter than actually do (or vice versa). An extended MCV statistic on (production_year, id) lets the planner compute the correct number of distinct titles per year bucket, fixing the nested-loop/hash estimate on the ci join. This is the lowest-risk, highest-signal lever for a drifting workload where correlated-column estimates are the explicit symptom; it's reversible and doesn't reshape user-facing semantics.", "pore": "auto_safe", "risk_level": "low", "escalated": false, "human_judge": null, "human_decision": null, "human_rationale": null, "baseline_p99": 12.895, "candidate_p99": 12.3, "within_noise": true, "decision": "discard", "proposer_tokens": {"input_tokens": 387, "output_tokens": 193}, "human_tokens": {}}
{"style": "linear_ramp", "iteration": 7, "drift": 0.3684, "regime": "shifting", "model": "MiniMax-M3", "candidate": {"type": "statistics", "params": {"columns": {"item": ["movie_id", "role_id", "nr_order"]}, "table": "cast_info"}, "reversible": true}, "proposer_reasoning": "The query joins title→cast_info on movie_id, and cast_info filters/aggregates across many rows per movie. With drift=0.37 and emerging analytical scans, the planner likely under/overestimates join cardinality because it has no joint stats across movie_id, role_id, and nr_order. Extended statistics here directly target the bad row-count estimate flagged in the workload and stabilize plans against the regime's plan flips.", "pore": "auto_safe", "risk_level": "low", "escalated": false, "human_judge": null, "human_decision": null, "human_rationale": null, "baseline_p99": 12.524, "candidate_p99": 12.524, "within_noise": false, "decision": "keep", "proposer_tokens": {"input_tokens": 387, "output_tokens": 185}, "human_tokens": {}}
{"style": "linear_ramp", "iteration": 8, "drift": 0.4211, "regime": "shifting", "model": "MiniMax-M3", "candidate": {"type": "statistics", "params": {"columns": ["production_year", "id"], "table": "title"}, "reversible": true}, "proposer_reasoning": "Under drift=0.42, the planner's row-count estimate for `t.production_year BETWEEN 2000 AND 2010` is the root cause of plan flips. Extended statistics on (production_year, id) directly target the misestimation on this exact query (and any analytical scan filtering by year and grouping/joining on id), without touching the access path. This is the lowest-blast-radius lever that actually addresses the stated bad row-count estimate, and it generalizes to other drifting analytical queries that combine these columns.", "pore": "auto_safe", "risk_level": "low", "escalated": false, "human_judge": null, "human_decision": null, "human_rationale": null, "baseline_p99": 12.524, "candidate_p99": 11.907, "within_noise": true, "decision": "discard", "proposer_tokens": {"input_tokens": 1041, "output_tokens": 613}, "human_tokens": {}}
{"style": "linear_ramp", "iteration": 9, "drift": 0.4737, "regime": "shifting", "model": "MiniMax-M3", "candidate": {"type": "guc", "params": {"name": "random_page_cost", "value": "1.1"}, "reversible": true}, "proposer_reasoning": "Under a shifting regime (drift=0.47) the planner's choice between index nested-loop and hash/hash-join plans for the title⇄cast_info join is unstable because cost parameters are tuned for spinning disk. With cast_info.movie_id now indexed and a production_year range that selects a meaningful fraction of title rows, lowering random_page_cost to 1.1 (SSD-appropriate) makes the index-driven plan stably cheaper than a seqscan+hash, which directly attacks the bad rowcount → plan-flip pathology without adding write overhead. Reversible at the session/cluster level.", "pore": "auto_safe", "risk_level": "low", "escalated": false, "human_judge": null, "human_decision": null, "human_rationale": null, "baseline_p99": 11.373, "candidate_p99": 11.373, "within_noise": false, "decision": "keep", "proposer_tokens": {"input_tokens": 415, "output_tokens": 195}, "human_tokens": {}}
{"style": "linear_ramp", "iteration": 10, "drift": 0.5263, "regime": "shifting", "model": "MiniMax-M3", "candidate": {"type": "statistics", "params": {"columns": ["movie_id", "role_id", "nr_order"], "table": "cast_info"}, "reversible": true}, "proposer_reasoning": "The failing query joins title to cast_info on movie_id and then GROUP BYs t.id, effectively needing per-movie cast row counts. The planner already has an index on cast_info(movie_id) but still misestimates how many cast_info rows match each title (likely because role_id/nr_order distributions skew per movie). Extended statistics over (movie_id, role_id, nr_order) lets the planner estimate group multiplicities much better, fixing the bad rowcount and stabilizing the plan against drift. It's reversible, low blast radius, and directly targets the symptom described.", "pore": "auto_safe", "risk_level": "low", "escalated": false, "human_judge": null, "human_decision": null, "human_rationale": null, "baseline_p99": 11.373, "candidate_p99": 11.91, "within_noise": true, "decision": "rollback", "proposer_tokens": {"input_tokens": 1060, "output_tokens": 215}, "human_tokens": {}}
{"style": "linear_ramp", "iteration": 11, "drift": 0.5789, "regime": "shifting", "model": "MiniMax-M3", "candidate": {"type": "statistics", "params": {"columns": {"item": ["production_year", "id"]}, "table": "title"}, "reversible": true}, "proposer_reasoning": "The workload groups by t.id after filtering by production_year; planner lacks correlation stats between the filter column and the group key, so row estimates blow up under drift. Extended statistics on (production_year, id) directly targets the misestimation without adding a costly index, and complements the existing (production_year, kind_id) stats as the analytical mix shifts.", "pore": "auto_safe", "risk_level": "low", "escalated": false, "human_judge": null, "human_decision": null, "human_rationale": null, "baseline_p99": 11.373, "candidate_p99": 12.396, "within_noise": true, "decision": "rollback", "proposer_tokens": {"input_tokens": 434, "output_tokens": 159}, "human_tokens": {}}
{"style": "linear_ramp", "iteration": 12, "drift": 0.6316, "regime": "turbulent", "model": "MiniMax-M3", "candidate": {"type": "guc", "params": {"name": "hash_mem_multiplier", "value": "3.0"}, "reversible": true}, "proposer_reasoning": "Hash joins are explicitly reported as spilling — the dominant p99 driver on a 5-table join under memory pressure. Raising hash_mem_multiplier (PG13+) lets hash tables grow ~3x before spilling, directly fixing the spill symptom without globally inflating work_mem (which would hurt the write-burst side). Reversible session-level GUC, no service bounce, low blast radius, and the most causally targeted remaining lever once indexes/stats are exhausted.", "pore": "auto_safe", "risk_level": "low", "escalated": false, "human_judge": null, "human_decision": null, "human_rationale": null, "baseline_p99": 10.441, "candidate_p99": 10.441, "within_noise": false, "decision": "keep", "proposer_tokens": {"input_tokens": 437, "output_tokens": 517}, "human_tokens": {}}
{"style": "linear_ramp", "iteration": 13, "drift": 0.6842, "regime": "turbulent", "model": "MiniMax-M3", "candidate": {"type": "guc", "params": {"name": "work_mem", "value": "256MB"}, "reversible": true}, "proposer_reasoning": "Hash joins are spilling under a 5-table join with 300k cast_info rows; raising work_mem is the most direct lever to stop disk-based hash spills and stabilize the plan against hash-join batching fallbacks during write bursts. Session-scoped, reversible, and doesn't bounce the service like shared_buffers/max_connections would.", "pore": "auto_safe", "risk_level": "low", "escalated": false, "human_judge": null, "human_decision": null, "human_rationale": null, "baseline_p99": 9.357, "candidate_p99": 9.357, "within_noise": false, "decision": "keep", "proposer_tokens": {"input_tokens": 457, "output_tokens": 141}, "human_tokens": {}}
{"style": "linear_ramp", "iteration": 14, "drift": 0.7368, "regime": "turbulent", "model": "MiniMax-M3", "candidate": {"type": "guc", "params": {"name": "default_statistics_target", "value": "500"}, "reversible": true}, "proposer_reasoning": "Plan flips on the 5-table join under write churn are a cardinality-estimation problem, not an index problem — the planner is making bad join-order / join-method choices because histograms are too coarse to discriminate after concurrent writes distort the distribution. Raising default_statistics_target to 500 forces ANALYZE to gather finer-grained histograms on production_year, kind_id, and the cast_info columns, which directly stabilizes row estimates feeding the 5-table join. It is per-database, non-disruptive (no service bounce, unlike shared_buffers/max_connections), and addresses the root cause of the regressions that targeted indexes cannot.", "pore": "auto_safe", "risk_level": "low", "escalated": false, "human_judge": null, "human_decision": null, "human_rationale": null, "baseline_p99": 9.072, "candidate_p99": 9.072, "within_noise": false, "decision": "keep", "proposer_tokens": {"input_tokens": 474, "output_tokens": 809}, "human_tokens": {}}
{"style": "linear_ramp", "iteration": 15, "drift": 0.7895, "regime": "turbulent", "model": "MiniMax-M3", "candidate": {"type": "guc", "params": {"blast_radius": "high", "name": "effective_cache_size", "value": "16GB"}, "reversible": true}, "proposer_reasoning": "With random_page_cost already at 1.1 and write-heavy churn causing the planner to oscillate between hash and nested-loop plans on the 5-table join, the missing piece is telling the planner how much of the dataset is realistically cached. Setting effective_cache_size to ~16GB lets the cost model trust index scans more confidently, reducing plan flips under drift and indirectly cutting hash-join pressure (which is already spilling despite hash_mem_multiplier=3.0). Reversible via reload; blast_radius high because it's a postgresql.conf-level change affecting every session's plan choices.", "pore": "blast_radius", "risk_level": "high", "escalated": true, "human_judge": "claude-sonnet-4-6", "human_decision": "approve", "human_rationale": "This is a GUC (Grand Unified Configuration) change to `effective_cache_size`, which is a **planner hint parameter only** — it does not allocate memory, does not move data, and does not restructure any schema or indexes. It is fully reversible with a single `SET` or config reload. The change is appropriate given the described operating regime: write-heavy bursts with connection churn are driving memory pressure, and plan regressions on multi-table joins are the primary symptom. `effective_cache_size` is exactly the lever that tells the query planner how much OS/buffer cache is available for index scans vs. sequential scans — an underestimate here is a well-known cause of the planner choosing merge/hash joins or sequential scans over nested-loop/index plans, which matches the described regression pattern. Setting it to 16GB is reasonable for a system under this kind of workload; it is the standard recommendation to set this to ~50–75% of total system RAM on a dedicated DB server (implying a host with 24–32GB RAM, which is common). While drift is high (0.79) and the blast radius is flagged as high, the actual risk of this specific GUC is low: worst case, the planner makes suboptimal choices and the value is immediately rolled back. The blast radius flag is correct in that it affects all query plans system-wide, but that is also precisely why this is the right tool when plan regressions are widespread — a targeted single-index change would not address systemic planner misconfiguration. Approving: monitor p99 latency and plan shapes on multi-table joins within the next 15–30 minutes post-apply; be ready to revert if regressions worsen rather than improve.", "baseline_p99": null, "candidate_p99": null, "within_noise": null, "decision": "escalated", "proposer_tokens": {"input_tokens": 477, "output_tokens": 398}, "human_tokens": {"input_tokens": 991, "output_tokens": 439}}
{"style": "linear_ramp", "iteration": 16, "drift": 0.8421, "regime": "turbulent", "model": "MiniMax-M3", "candidate": {"type": "guc", "params": {"blast_radius": "high", "name": "max_connections", "value": 100}, "reversible": true}, "proposer_reasoning": "Connection churn is explicitly called out and work_mem=256MB × hash_mem_multiplier=3.0 has not stopped hash-join spilling — this almost certainly means backend count is so high that N×work_mem reservation is overwhelming RAM and forcing hash spills regardless of per-op budget. Capping max_connections (bounce required, but reversible via postgresql.conf rollback) directly attacks the dominant memory-pressure source under write-heavy bursts, which should let existing per-query work_mem actually take effect and stabilize hash-join plans. Honest caveat: requires a service bounce, but the regime says systemic fixes are on the table.", "pore": "blast_radius", "risk_level": "high", "escalated": true, "human_judge": "claude-sonnet-4-6", "human_decision": "reject", "human_rationale": "Under a turbulent operating regime (drift=0.84) with active write-heavy bursts and connection churn already in progress, reducing max_connections to 100 is the wrong lever at the wrong moment. While the GUC is technically reversible (requires a PostgreSQL reload or restart depending on the version), applying it mid-incident introduces serious blast-radius risk: any connections currently open beyond the new ceiling will not be immediately affected, but new connection attempts will be refused, potentially cascading into application-layer errors and outages for live users. The stated culprits are memory pressure and planner misconfiguration on multi-table joins — neither of which is directly addressed by capping connections at 100. In fact, if the connection churn is driven by a poorly-tuned connection pooler or application retry storms, slashing max_connections will worsen the retry pressure, not relieve it. The correct remediation path is: (1) diagnose and tune the planner (e.g., enable_hashjoin, enable_mergejoin, join_collapse_limit, parallel query settings), (2) address memory pressure via work_mem / shared_buffers tuning, and (3) introduce or right-size a connection pooler (PgBouncer) rather than hard-capping at the database level during an active incident. Approving a high-blast-radius connection ceiling drop under drift=0.84 without a clear causal link to the presenting symptoms is not defensible.", "baseline_p99": null, "candidate_p99": null, "within_noise": null, "decision": "escalated", "proposer_tokens": {"input_tokens": 1176, "output_tokens": 651}, "human_tokens": {"input_tokens": 988, "output_tokens": 371}}
