{"style": "oscillating", "iteration": 14, "drift": 0.7351, "regime": "turbulent", "model": "claude-opus-4-5", "candidate": {"type": "guc", "params": {"name": "effective_cache_size", "value": "4GB"}, "reversible": true}, "proposer_reasoning": "With plan flips on multi-table joins and memory pressure indicated, the planner may be underestimating available cache and choosing hash joins that spill instead of index-nested-loop plans. Raising effective_cache_size (a session-safe GUC, no restart needed) guides the planner toward index-based plans when indexes exist, reducing plan volatility and spill-related latency on the 5-table join workload.", "pore": "auto_safe", "risk_level": "low", "escalated": false, "human_judge": null, "human_decision": null, "human_rationale": null, "baseline_p99": 27.551, "candidate_p99": 26.127, "within_noise": true, "decision": "discard", "proposer_tokens": {"input_tokens": 1685, "output_tokens": 195}, "human_tokens": {}}
{"style": "oscillating", "iteration": 15, "drift": 0.5, "regime": "shifting", "model": "claude-opus-4-5", "candidate": {"type": "statistics", "params": {"table": "cast_info", "columns": ["movie_id", "role_id"]}, "reversible": true}, "proposer_reasoning": "The problem query joins cast_info on movie_id with a filtered title table. With analytical scans appearing and bad row-count estimates noted, the planner likely misjudges cardinality when estimating how many cast_info rows match the joined movies. Extended statistics on cast_info(movie_id, role_id) helps the planner understand the correlation between which movies have cast entries and their role distribution, improving join cardinality estimates and reducing plan flips.", "pore": "auto_safe", "risk_level": "low", "escalated": false, "human_judge": null, "human_decision": null, "human_rationale": null, "baseline_p99": 27.551, "candidate_p99": 26.798, "within_noise": true, "decision": "discard", "proposer_tokens": {"input_tokens": 1679, "output_tokens": 203}, "human_tokens": {}}
{"style": "oscillating", "iteration": 16, "drift": 0.2649, "regime": "calm", "model": "claude-opus-4-5", "candidate": {"type": "index", "params": {"table": "movie_keyword", "columns": ["keyword_id"]}, "reversible": true}, "proposer_reasoning": "The problem query on title.production_year already has an index applied. Looking at the schema, movie_keyword has a composite index on (movie_id, keyword_id) but lacks a standalone index on keyword_id. Queries filtering or joining on keyword_id alone cannot efficiently use the composite index. Adding this targeted index supports keyword-based lookups common in read-heavy OLTP workloads involving movie searches.", "pore": "auto_safe", "risk_level": "low", "escalated": false, "human_judge": null, "human_decision": null, "human_rationale": null, "baseline_p99": 18.249, "candidate_p99": 18.249, "within_noise": false, "decision": "keep", "proposer_tokens": {"input_tokens": 1645, "output_tokens": 187}, "human_tokens": {}}
{"style": "oscillating", "iteration": 17, "drift": 0.1196, "regime": "calm", "model": "claude-opus-4-5", "candidate": {"type": "index", "params": {"table": "title", "columns": ["kind_id"]}, "reversible": true}, "proposer_reasoning": "The production_year index already exists for the problem query. Since title.kind_id is a foreign key often used in joins with kind_type and may appear in WHERE clauses filtering by kind, adding this index will support efficient lookups and joins on the kind_id column, improving query performance for workloads involving title-kind relationships.", "pore": "auto_safe", "risk_level": "low", "escalated": false, "human_judge": null, "human_decision": null, "human_rationale": null, "baseline_p99": 11.616, "candidate_p99": 11.616, "within_noise": false, "decision": "keep", "proposer_tokens": {"input_tokens": 1667, "output_tokens": 167}, "human_tokens": {}}
{"style": "oscillating", "iteration": 18, "drift": 0.1196, "regime": "calm", "model": "claude-opus-4-5", "candidate": {"type": "index", "params": {"table": "cast_info", "columns": ["role_id"]}, "reversible": true}, "proposer_reasoning": "The problem query on title.production_year already has an index applied. Given the schema and read-heavy OLTP pattern, cast_info is heavily joined and filtered. An index on role_id enables efficient lookups when filtering by role type in actor/crew queries, which is a common pattern joining cast_info to other tables.", "pore": "auto_safe", "risk_level": "low", "escalated": false, "human_judge": null, "human_decision": null, "human_rationale": null, "baseline_p99": 7.548, "candidate_p99": 7.548, "within_noise": false, "decision": "keep", "proposer_tokens": {"input_tokens": 1687, "output_tokens": 168}, "human_tokens": {}}
{"style": "oscillating", "iteration": 19, "drift": 0.2649, "regime": "calm", "model": "claude-opus-4-5", "candidate": {"type": "index", "params": {"table": "title", "columns": ["production_year", "id"]}, "reversible": true}, "proposer_reasoning": "The problem query filters on production_year (already indexed) but does SELECT *. A covering index including 'id' can speed up index-only scans for queries that join on id after filtering by year, reducing heap fetches. This is a targeted, reversible enhancement to the existing production_year index strategy.", "pore": "auto_safe", "risk_level": "low", "escalated": false, "human_judge": null, "human_decision": null, "human_rationale": null, "baseline_p99": 5.32, "candidate_p99": 5.32, "within_noise": false, "decision": "keep", "proposer_tokens": {"input_tokens": 1709, "output_tokens": 165}, "human_tokens": {}}