{"style": "accel_creep", "iteration": 13, "drift": 0.4681, "regime": "shifting", "model": "MiniMax-M3", "candidate": {"type": "guc", "params": {"name": "default_statistics_target", "value": "500"}, "reversible": true}, "proposer_reasoning": "The drift is 0.47 with shifting workload and correlated-column filters causing bad rowcount estimates and plan flips. We've already added multiple extended statistics and indexes on the title columns, but the planner still misestimates the production_year BETWEEN selectivity for this group-by query. Raising default_statistics_target globally gives the planner denser histograms/mCVFs for production_year and other columns, which directly attacks the root cause (bad rowcount estimates → plan flips) without adding more redundant indexes. It's a session/GUC-level change, reversible, and benefits the whole shifting regime rather than this one query — the right lever when the best single index isn't obvious.", "pore": "auto_safe", "risk_level": "low", "escalated": false, "human_judge": null, "human_decision": null, "human_rationale": null, "baseline_p99": 3.911, "candidate_p99": 3.911, "within_noise": false, "decision": "keep", "proposer_tokens": {"input_tokens": 470, "output_tokens": 200}, "human_tokens": {}}
{"style": "accel_creep", "iteration": 14, "drift": 0.5429, "regime": "shifting", "model": "MiniMax-M3", "candidate": {"type": "statistics", "params": {"columns": ["movie_id", "role_id"], "table": "cast_info"}, "reversible": true}, "proposer_reasoning": "The query joins title→cast_info on movie_id then groups by t.id; cast_info row count per title is heavily correlated with role_id (e.g., feature films vs shorts). With ~300k rows and no extended stats on cast_info, the planner likely misestimates the join cardinality, causing plan flips. Extended statistics on (movie_id, role_id) gives a multivariate MCV that pins the estimate close to reality, stabilizing the plan choice across the drifting workload. It's reversible and doesn't touch claim surface.", "pore": "auto_safe", "risk_level": "low", "escalated": false, "human_judge": null, "human_decision": null, "human_rationale": null, "baseline_p99": 3.911, "candidate_p99": 3.95, "within_noise": true, "decision": "rollback", "proposer_tokens": {"input_tokens": 1113, "output_tokens": 194}, "human_tokens": {}}
{"style": "accel_creep", "iteration": 15, "drift": 0.6233, "regime": "turbulent", "model": "MiniMax-M3", "candidate": {"type": "guc", "params": {}, "reversible": true}, "proposer_reasoning": "Hash joins spilling under memory pressure + connection churn on a 5-table join is the classic symptom of work_mem starvation at the per-session level. Bumping work_mem directly reduces spill-to-disk for the hash joins that dominate p99, is per-session (low blast radius — doesn't bounce service like shared_buffers would), and is instantly reversible via RESET. Systemic params like shared_buffers or max_connections would require a restart and reshape behavior for every session, which is too aggressive given we haven't yet addressed the per-query memory budget that's almost certainly the proximate cause of the spill.", "pore": "auto_safe", "risk_level": "low", "escalated": false, "human_judge": null, "human_decision": null, "human_rationale": null, "baseline_p99": 3.598, "candidate_p99": 3.598, "within_noise": false, "decision": "keep", "proposer_tokens": {"input_tokens": 1096, "output_tokens": 172}, "human_tokens": {}}
{"style": "accel_creep", "iteration": 16, "drift": 0.7091, "regime": "turbulent", "model": "MiniMax-M3", "candidate": {"type": "guc", "params": {"name": "work_mem", "value": "'96MB'"}, "reversible": true}, "proposer_reasoning": "Hash joins are spilling under concurrent write load — this is the dominant p99 driver now. A targeted per-session work_mem bump lets the 5-table join's hash tables stay in memory, eliminating the spill-driven latency tail without the blast radius of shared_buffers/max_connections. Reversible by resetting to default; session-scope, not persistent.", "pore": "auto_safe", "risk_level": "low", "escalated": false, "human_judge": null, "human_decision": null, "human_rationale": null, "baseline_p99": 3.598, "candidate_p99": 3.546, "within_noise": true, "decision": "discard", "proposer_tokens": {"input_tokens": 1119, "output_tokens": 146}, "human_tokens": {}}
{"style": "accel_creep", "iteration": 17, "drift": 0.8006, "regime": "turbulent", "model": "MiniMax-M3", "candidate": {"type": "guc", "params": {"name": "work_mem", "value": 262144}, "reversible": true}, "proposer_reasoning": "Hash joins on the 5-table join are spilling to disk under concurrent write pressure — that's the dominant p99 driver now. Raising work_mem (per-session, reversible, no service bounce) gives the hash joins enough memory to stay in-RAM, directly attacking the spill symptom without the blast radius of shared_buffers or max_connections. Targeted and reversible is the right shape here; systemic memory knobs can wait until we confirm spill behavior.", "pore": "auto_safe", "risk_level": "low", "escalated": false, "human_judge": null, "human_decision": null, "human_rationale": null, "baseline_p99": 3.598, "candidate_p99": 3.597, "within_noise": true, "decision": "discard", "proposer_tokens": {"input_tokens": 1119, "output_tokens": 163}, "human_tokens": {}}
{"style": "accel_creep", "iteration": 18, "drift": 0.8975, "regime": "regime_break", "model": "MiniMax-M3", "candidate": {"type": "guc", "params": {"name": "synchronous_commit", "value": "off"}, "reversible": true}, "proposer_reasoning": "In a regime_break with mixed OLTP+OLAP bulk inserts, p99 sawtoothing 80ms→900ms is the canonical fingerprint of fsync/synchronous_commit waits on the bulk-insert path racing with the join storm. Every targeted index/statistics fix is already exhausted. Relaxing synchronous_commit directly attacks the commit-side latency spikes without touching fsync (no corruption risk), without full_page_writes, and without any schema migration. It is a systemic, trivially reversible GUC — exactly the decisive systemic fix the regime calls for to stop the bleeding before resorting to irreversible options like VACUUM FULL or query rewrites that change semantics.", "pore": "blast_radius", "risk_level": "high", "escalated": true, "human_judge": "claude-sonnet-4-6", "human_decision": "approve", "human_rationale": "This is a defensible, time-bounded call under an active crisis. The change — setting synchronous_commit=off — is a well-understood PostgreSQL GUC that trades strict write durability for dramatically reduced commit latency by decoupling the WAL flush acknowledgment from the client response. Critically, it is fully reversible (a single SET or postgresql.conf edit + reload brings it back), carries no risk of data corruption or structural damage, and does not touch schema, indexes, or user-facing data directly. In an unprecedented regime_break with drift=0.90 and p99 latency spiking ~10x, the most likely systemic bottleneck is write amplification pressure on the WAL sync path — exactly what this GUC addresses. The blast radius concern is real but bounded: the worst-case consequence is loss of up to ~200ms of committed transactions in the event of a hard OS/hardware crash (not a Postgres crash, which is safe). This risk window is narrow and acceptable for a short-term stabilization measure during an active incident, especially if the team is monitoring for crashes and has a recovery plan. The alternative — leaving p99 spiking at 10x with no systemic lever pulled — carries a higher probability of broader service failure. Conditions for this approval: (1) the team must set a time-boxed review (e.g., 2 hours) to reassess once the spike is contained, (2) the change should be logged as a temporary mitigation with an explicit revert ticket, and (3) if the workload involves financial or ACID-critical writes, a narrow session-level override (SET LOCAL synchronous_commit=off) should be considered instead of a cluster-wide change.", "baseline_p99": null, "candidate_p99": null, "within_noise": null, "decision": "escalated", "proposer_tokens": {"input_tokens": 1176, "output_tokens": 564}, "human_tokens": {"input_tokens": 981, "output_tokens": 426}}
{"style": "accel_creep", "iteration": 19, "drift": 1.0, "regime": "regime_break", "model": "MiniMax-M3", "candidate": {"type": "guc", "params": {}, "reversible": true}, "proposer_reasoning": "Different lever from the already-escalated synchronous_commit=off. Bulk inserts in the OLTP+OLAP storm generate large WAL volume; wal_compression=on reduces on-disk WAL size and per-commit WAL write time, lowering the I/O pressure that drives the 80ms->900ms p99 oscillation. It also helps recovery time, is fully reversible (SET in postgresql.conf), and is safe — Postgres always reads back compressed WAL correctly. Complements rather than overlaps with synchronous_commit=off (that helps commit-wait latency; this helps the underlying WAL write bandwidth that is the root cause of the I/O contention bleeding into the read side of the join workload).", "pore": "auto_safe", "risk_level": "low", "escalated": false, "human_judge": null, "human_decision": null, "human_rationale": null, "baseline_p99": 3.283, "candidate_p99": 3.283, "within_noise": false, "decision": "keep", "proposer_tokens": {"input_tokens": 1227, "output_tokens": 728}, "human_tokens": {}}