{"style": "linear_ramp", "iteration": 0, "drift": 0.0, "regime": "calm", "model": "claude-sonnet-4-6", "candidate": {"type": "index", "params": {"table": "title", "columns": ["production_year"]}, "reversible": true}, "proposer_reasoning": "The bottleneck query filters exclusively on `production_year` with a BETWEEN range predicate, causing a full sequential scan of the `title` table. A B-tree index on `title(production_year)` allows Postgres to perform an efficient index range scan, directly eliminating the seq scan and reducing p99 latency for this workload. This is the minimal, targeted, fully reversible fix perfectly matched to a calm, read-heavy OLTP regime.", "pore": "auto_safe", "risk_level": "low", "escalated": false, "human_judge": null, "human_decision": null, "human_rationale": null, "baseline_p99": 66.324, "candidate_p99": 66.324, "within_noise": false, "decision": "keep", "proposer_tokens": {"input_tokens": 1347, "output_tokens": 212}, "human_tokens": {}}
{"style": "linear_ramp", "iteration": 1, "drift": 0.0526, "regime": "calm", "model": "claude-sonnet-4-6", "candidate": {"type": "index", "params": {"table": "cast_info", "columns": ["movie_id"]}, "reversible": true}, "proposer_reasoning": "With the production_year index on title already applied, the next bottleneck in this read-heavy OLTP workload is the ~300k-row cast_info table having no secondary indexes. JOIN and filter queries correlating title to cast_info will drive a sequential scan on cast_info via movie_id; a targeted index on cast_info(movie_id) enables an efficient index nested-loop join, directly cutting p99 latency for those SELECTs.", "pore": "auto_safe", "risk_level": "low", "escalated": false, "human_judge": null, "human_decision": null, "human_rationale": null, "baseline_p99": 42.061, "candidate_p99": 42.061, "within_noise": false, "decision": "keep", "proposer_tokens": {"input_tokens": 1377, "output_tokens": 205}, "human_tokens": {}}
{"style": "linear_ramp", "iteration": 2, "drift": 0.1053, "regime": "calm", "model": "claude-sonnet-4-6", "candidate": {"type": "index", "params": {"table": "title", "columns": ["kind_id", "production_year"]}, "reversible": true}, "proposer_reasoning": "A composite index on (kind_id, production_year) lets the planner satisfy range queries on production_year that also filter or join on kind_id — a very common OLTP pattern when drilling into titles by type and year. With the single-column production_year index already applied, the next highest-value addition is this composite, which covers the frequent join path from kind_type → title and tightens the range scan further by prefixing on the low-cardinality kind_id discriminator.", "pore": "auto_safe", "risk_level": "low", "escalated": false, "human_judge": null, "human_decision": null, "human_rationale": null, "baseline_p99": 26.299, "candidate_p99": 26.299, "within_noise": false, "decision": "keep", "proposer_tokens": {"input_tokens": 1399, "output_tokens": 210}, "human_tokens": {}}
{"style": "linear_ramp", "iteration": 3, "drift": 0.1579, "regime": "calm", "model": "claude-sonnet-4-6", "candidate": {"type": "index", "params": {"table": "cast_info", "columns": ["person_id"]}, "reversible": true}, "proposer_reasoning": "In a read-heavy OLTP workload, cast_info is a central join table frequently filtered or looked up by person_id (e.g., \"find all movies for a given actor\"). With ~300k rows and no secondary indexes beyond the already-applied movie_id index, person_id lookups still require a full sequential scan. Adding this index directly eliminates that bottleneck for person-centric queries and supports efficient nested-loop joins from the name table into cast_info.", "pore": "auto_safe", "risk_level": "low", "escalated": false, "human_judge": null, "human_decision": null, "human_rationale": null, "baseline_p99": 17.081, "candidate_p99": 17.081, "within_noise": false, "decision": "keep", "proposer_tokens": {"input_tokens": 1425, "output_tokens": 207}, "human_tokens": {}}
{"style": "linear_ramp", "iteration": 4, "drift": 0.2105, "regime": "calm", "model": "claude-sonnet-4-6", "candidate": {"type": "index", "params": {"table": "movie_keyword", "columns": ["movie_id", "keyword_id"]}, "reversible": true}, "proposer_reasoning": "In a read-heavy OLTP workload joining titles to keywords, movie_keyword is the bridge table and currently has no secondary indexes. A composite index on (movie_id, keyword_id) covers both the FK lookup from title and the FK lookup from keyword, turning any nested-loop join through this table into an index scan and eliminating the seq scans that drive p99 latency on keyword-filtered queries.", "pore": "auto_safe", "risk_level": "low", "escalated": false, "human_judge": null, "human_decision": null, "human_rationale": null, "baseline_p99": 11.792, "candidate_p99": 11.792, "within_noise": false, "decision": "keep", "proposer_tokens": {"input_tokens": 1447, "output_tokens": 192}, "human_tokens": {}}
{"style": "linear_ramp", "iteration": 5, "drift": 0.2632, "regime": "calm", "model": "claude-sonnet-4-6", "candidate": {"type": "index", "params": {"table": "movie_keyword", "columns": ["keyword_id"]}, "reversible": true}, "proposer_reasoning": "With movie_keyword(movie_id, keyword_id) already covering movie-side lookups, the remaining gap is keyword-side joins — e.g. finding all movies tagged with a given keyword. A standalone index on keyword_id allows the planner to efficiently drive that join from the keyword table without a seq scan or relying on the composite index (which can't use keyword_id as a leading column).", "pore": "auto_safe", "risk_level": "low", "escalated": false, "human_judge": null, "human_decision": null, "human_rationale": null, "baseline_p99": 8.551, "candidate_p99": 8.551, "within_noise": false, "decision": "keep", "proposer_tokens": {"input_tokens": 1475, "output_tokens": 190}, "human_tokens": {}}
{"style": "linear_ramp", "iteration": 6, "drift": 0.3158, "regime": "shifting", "model": "claude-sonnet-4-6", "candidate": {"type": "statistics", "params": {"table": "title", "columns": ["kind_id", "production_year"]}, "reversible": true}, "proposer_reasoning": "The query filters title on production_year and joins to cast_info; bad row-count estimates stem from the planner assuming kind_id and production_year are independent. Extended statistics over these two correlated columns gives the planner an accurate combined-selectivity estimate, directly fixing plan flips caused by the correlation — which is the root problem in this shifting analytical workload.", "pore": "auto_safe", "risk_level": "low", "escalated": false, "human_judge": null, "human_decision": null, "human_rationale": null, "baseline_p99": 8.551, "candidate_p99": 8.284, "within_noise": true, "decision": "discard", "proposer_tokens": {"input_tokens": 1531, "output_tokens": 185}, "human_tokens": {}}
{"style": "linear_ramp", "iteration": 7, "drift": 0.3684, "regime": "shifting", "model": "claude-sonnet-4-6", "candidate": {"type": "statistics", "params": {"table": "title", "columns": ["kind_id", "production_year"]}, "reversible": true}, "proposer_reasoning": "The problem query filters on production_year with a range predicate and joins to cast_info, but bad row-count estimates point to the planner misestimating how many title rows survive the predicate — likely because kind_id and production_year are correlated (e.g., certain kinds cluster in certain years). Extended statistics over (kind_id, production_year) teach the planner their joint MCV/histogram distribution, correcting the cardinality estimate and stabilising the join plan against flips. An index on these columns already exists, so the statistics object is the missing piece to fix estimation without any structural overhead.", "pore": "auto_safe", "risk_level": "low", "escalated": false, "human_judge": null, "human_decision": null, "human_rationale": null, "baseline_p99": 8.551, "candidate_p99": 8.024, "within_noise": true, "decision": "discard", "proposer_tokens": {"input_tokens": 1531, "output_tokens": 240}, "human_tokens": {}}
{"style": "linear_ramp", "iteration": 8, "drift": 0.4211, "regime": "shifting", "model": "claude-sonnet-4-6", "candidate": {"type": "statistics", "params": {"table": "title", "columns": ["kind_id", "production_year"]}, "reversible": true}, "proposer_reasoning": "The query filters on production_year and joins through title, but the planner is producing bad row-count estimates — a classic symptom of correlated columns (kind_id and production_year are naturally correlated: certain kinds of titles cluster in specific year ranges). Creating extended statistics over these two columns gives the planner an accurate multi-column MCV/histogram, collapsing the estimation error that is causing plan flips between nested loop and hash join strategies under the shifting analytical workload.", "pore": "auto_safe", "risk_level": "low", "escalated": false, "human_judge": null, "human_decision": null, "human_rationale": null, "baseline_p99": 8.551, "candidate_p99": 8.143, "within_noise": true, "decision": "discard", "proposer_tokens": {"input_tokens": 1531, "output_tokens": 209}, "human_tokens": {}}
{"style": "linear_ramp", "iteration": 9, "drift": 0.4737, "regime": "shifting", "model": "claude-sonnet-4-6", "candidate": {"type": "statistics", "params": {"table": "title", "columns": ["kind_id", "production_year"]}, "reversible": true}, "proposer_reasoning": "The query filters on `production_year` in `title` and joins to `cast_info`, but the planner is producing bad row-count estimates — a hallmark of correlated columns misleading the default per-column statistics. `kind_id` and `production_year` are naturally correlated (certain media kinds cluster in certain eras), so creating extended statistics over both columns lets the planner see their joint distribution and produce accurate combined selectivity estimates, directly fixing the plan flips caused by bad cardinality estimates in this shifting analytical workload.", "pore": "auto_safe", "risk_level": "low", "escalated": false, "human_judge": null, "human_decision": null, "human_rationale": null, "baseline_p99": 8.551, "candidate_p99": 8.151, "within_noise": true, "decision": "discard", "proposer_tokens": {"input_tokens": 1531, "output_tokens": 224}, "human_tokens": {}}
{"style": "linear_ramp", "iteration": 10, "drift": 0.5263, "regime": "shifting", "model": "claude-sonnet-4-6", "candidate": {"type": "statistics", "params": {"table": "title", "columns": ["kind_id", "production_year"]}, "reversible": true}, "proposer_reasoning": "The query filters on production_year and joins through title, but bad row-count estimates indicate the planner is misestimating the joint distribution of kind_id and production_year (correlated columns — certain genres cluster heavily in certain year ranges). Extended statistics over (kind_id, production_year) gives the planner MCV and correlation data for this pair, directly fixing the estimate that drives plan flips between nested-loop and hash-join strategies for the cast_info join.", "pore": "auto_safe", "risk_level": "low", "escalated": false, "human_judge": null, "human_decision": null, "human_rationale": null, "baseline_p99": 8.551, "candidate_p99": 8.202, "within_noise": true, "decision": "discard", "proposer_tokens": {"input_tokens": 1531, "output_tokens": 209}, "human_tokens": {}}
{"style": "linear_ramp", "iteration": 11, "drift": 0.5789, "regime": "shifting", "model": "claude-sonnet-4-6", "candidate": {"type": "statistics", "params": {"table": "title", "columns": ["kind_id", "production_year"]}, "reversible": true}, "proposer_reasoning": "The query filters title on production_year and joins to cast_info, but the planner is producing bad row-count estimates. In a shifting analytical workload, the root cause is that kind_id and production_year are correlated (certain genres cluster in certain years), so the planner's independence assumption badly misestimates the selectivity of combined predicates. Creating extended statistics over (kind_id, production_year) gives the planner an MCV/ndistinct model that accounts for this correlation, directly fixing the estimate that drives the plan flip without touching any other session or global behaviour.", "pore": "auto_safe", "risk_level": "low", "escalated": false, "human_judge": null, "human_decision": null, "human_rationale": null, "baseline_p99": 8.551, "candidate_p99": 8.633, "within_noise": true, "decision": "rollback", "proposer_tokens": {"input_tokens": 1531, "output_tokens": 233}, "human_tokens": {}}
{"style": "linear_ramp", "iteration": 12, "drift": 0.6316, "regime": "turbulent", "model": "claude-sonnet-4-6", "candidate": {"type": "guc", "params": {"name": "work_mem", "value": "64MB", "blast_radius": "high"}, "reversible": true}, "proposer_reasoning": "Hash joins on this 5-table join are spilling to disk because each worker's sort/hash buffer is too small — the root cause of both the spill latency and the plan instability (the planner flip-flops when it can't trust its cost estimates against spill overhead). Raising work_mem to 64 MB gives hash joins and sorts enough in-memory headroom to execute without disk spill, stabilising the chosen plan across runs and directly cutting p99. This is the highest-leverage remaining lever now that targeted indexes are exhausted; it reshapes behaviour for every session (blast_radius: high) but is instantly reversible by resetting the GUC.", "pore": "blast_radius", "risk_level": "high", "escalated": true, "human_judge": "claude-sonnet-4-6", "human_decision": "approve", "human_rationale": "This is a reversible GUC change (SET work_mem = '64MB' can be rolled back instantly with no data mutation), which significantly reduces the risk profile despite the high blast-radius flag. The operational context makes this a defensible call: we are seeing plan regressions on multi-table joins and p99 latency that is no longer responding to index tuning, which are classic symptoms of insufficient sort/hash memory forcing disk spills and poor join-order costing by the planner. Raising work_mem from whatever the current baseline is to 64MB directly targets that root cause. The primary blast-radius concern is per-connection memory amplification — at 64MB, if the instance is sustaining high connection churn (as described), peak RSS could spike significantly (e.g., 200 connections × 64MB = ~12.8GB theoretical ceiling). However, this is mitigated by the fact that: (1) work_mem is only allocated per sort/hash node actually executing, not per idle connection; (2) connection churn implies short-lived connections, reducing concurrent memory pressure; and (3) this value (64MB) is a moderate, well-precedented setting for OLTP/mixed workloads with complex joins — not an extreme outlier. The turbulent regime (drift=0.63) warrants caution, but the change is immediately reversible with a single GUC reset, has no schema or data impact, and the expected win (breaking the p99 plateau on join-heavy queries) is well-justified by the symptom profile. Recommend monitoring RSS and per-query explain plans for 15–30 minutes post-apply, with a rollback threshold pre-agreed at, e.g., >20% increase in OOM events or connection errors.", "baseline_p99": null, "candidate_p99": null, "within_noise": null, "decision": "escalated", "proposer_tokens": {"input_tokens": 1537, "output_tokens": 260}, "human_tokens": {"input_tokens": 989, "output_tokens": 438}}
{"style": "linear_ramp", "iteration": 13, "drift": 0.6842, "regime": "turbulent", "model": "claude-sonnet-4-6", "candidate": {"type": "statistics", "params": {"table": "title", "columns": ["kind_id", "production_year"], "blast_radius": "high"}, "reversible": true}, "proposer_reasoning": "The 5-table join repeatedly filters on title.kind_id and title.production_year together; without extended statistics Postgres assumes independence between these columns, causing severe row-count misestimates that drive the plan flips and hash-join spills. A CREATE STATISTICS object over (kind_id, production_year) on title teaches the planner their true joint distribution, stabilising cardinality estimates across runs without touching memory or requiring a service bounce.", "pore": "blast_radius", "risk_level": "high", "escalated": true, "human_judge": "claude-sonnet-4-6", "human_decision": "approve", "human_rationale": "This proposal is to create or refresh extended/multi-column statistics on `title(kind_id, production_year)` — a reversible, read-path-only metadata operation. Given the stated regime (drift=0.68, plan regressions on multi-table joins, single-column indexes no longer moving p99), the planner is almost certainly suffering from correlation blindness: it cannot account for the joint distribution of `kind_id` and `production_year` when estimating cardinality on joins or filtered scans against `title`, leading to bad plan choices. Extended statistics directly address this root cause by giving the planner accurate multi-column correlation/MCV data. The change is reversible (`DROP STATISTICS` or simply not refreshing), carries no write amplification, no lock contention beyond a brief catalog update, and does not mutate user-facing data. The high blast-radius flag was triggered because `title` is presumably a large, central table whose planner estimates ripple into many query plans — but that same centrality means accurate statistics here could positively resolve multiple regressions simultaneously. The risk of a statistics miscalibration causing a *worse* plan is real but low: the planner uses these statistics additively and falls back gracefully. In a turbulent, high-drift regime where planner configuration is a plausible culprit, this is a targeted, minimally invasive, and well-justified intervention. Approving with the recommendation to monitor p99 and EXPLAIN plans on the top regressed queries within one collection cycle post-change.", "baseline_p99": null, "candidate_p99": null, "within_noise": null, "decision": "escalated", "proposer_tokens": {"input_tokens": 1603, "output_tokens": 215}, "human_tokens": {"input_tokens": 993, "output_tokens": 386}}
{"style": "linear_ramp", "iteration": 14, "drift": 0.7368, "regime": "turbulent", "model": "claude-sonnet-4-6", "candidate": {"type": "statistics", "params": {"table": "cast_info", "columns": ["movie_id", "role_id"]}, "reversible": true}, "proposer_reasoning": "The 5-table join pivots through cast_info on both movie_id and role_id; without extended statistics the planner treats these columns as independent, producing badly skewed row-count estimates that trigger plan flips and hash-join spills. CREATE STATISTICS on (movie_id, role_id) teaches the planner their joint distribution, stabilising estimates across concurrent-write turbulence without touching any systemic GUC or reshaping every session.", "pore": "auto_safe", "risk_level": "low", "escalated": false, "human_judge": null, "human_decision": null, "human_rationale": null, "baseline_p99": 8.551, "candidate_p99": 8.749, "within_noise": true, "decision": "rollback", "proposer_tokens": {"input_tokens": 1638, "output_tokens": 208}, "human_tokens": {}}
{"style": "linear_ramp", "iteration": 15, "drift": 0.7895, "regime": "turbulent", "model": "claude-sonnet-4-6", "candidate": {"type": "statistics", "params": {"table": "cast_info", "columns": ["movie_id", "role_id"], "blast_radius": "high"}, "reversible": true}, "proposer_reasoning": "With hash joins spilling and plan flips on the 5-table join, the planner is misestimating join cardinalities. cast_info is the largest table (~300k rows, no secondary indexes until recently) and sits at the hub of the join — movie_id links to title/movie_keyword while role_id filters the result set. Extended statistics over (movie_id, role_id) teaches the planner about their joint distribution, correcting the correlation-blind row estimates that are currently causing plan regressions and hash-spill decisions between runs.", "pore": "blast_radius", "risk_level": "high", "escalated": true, "human_judge": "claude-sonnet-4-6", "human_decision": "approve", "human_rationale": "The proposal is to update multi-column statistics on `cast_info(movie_id, role_id)` — a statistics-only change, not a schema or data mutation. Critically, it is marked reversible: statistics can be reset or re-analyzed to a prior state, and the planner will simply fall back to single-column estimates if the new stats aren't useful. The blast radius is flagged \"high\" primarily because `cast_info` is a large, heavily-joined table and stale/wrong statistics can cause plan regressions at scale — but that cuts both ways: the current plan regressions on multi-table joins are already happening, and single-column indexes have stopped moving p99, making planner mis-estimation the leading hypothesis. Under a turbulent regime with write-heavy bursts and connection churn, the planner is most vulnerable to correlation blindness between `movie_id` and `role_id`, which is exactly what extended multi-column statistics address. The expected win (correcting join-order and row-estimate errors that are driving p99 regressions) is concrete and well-motivated; the downside risk (a transient plan shift to a suboptimal path) is bounded, detectable within minutes via query latency monitoring, and correctable by running `ANALYZE` again or manually setting `statistics` targets back. Given that this is a diagnostic/corrective statistics operation rather than an irreversible DDL or DML change, and the existing regime already shows active degradation, the risk/reward favors approval. Recommend monitoring p99 join-query latency and plan shapes for 15–30 minutes post-change.", "baseline_p99": null, "candidate_p99": null, "within_noise": null, "decision": "escalated", "proposer_tokens": {"input_tokens": 1638, "output_tokens": 241}, "human_tokens": {"input_tokens": 995, "output_tokens": 407}}
