{"style": "linear_ramp", "iteration": 0, "drift": 0.0, "regime": "calm", "model": "claude-haiku-4-5", "candidate": {"type": "index", "params": {"table": "title", "columns": ["production_year"]}, "reversible": true}, "proposer_reasoning": "The bottleneck is a full sequential scan on title.production_year for range queries (BETWEEN 2000 AND 2010). A B-tree index on production_year directly enables an efficient range scan, eliminating the seq scan and reducing p99 latency for this stable, read-heavy workload.", "pore": "auto_safe", "risk_level": "low", "escalated": false, "human_judge": null, "human_decision": null, "human_rationale": null, "baseline_p99": 66.324, "candidate_p99": 66.324, "within_noise": false, "decision": "keep", "proposer_tokens": {"input_tokens": 1346, "output_tokens": 168}, "human_tokens": {}}
{"style": "linear_ramp", "iteration": 1, "drift": 0.0526, "regime": "calm", "model": "claude-haiku-4-5", "candidate": {"type": "index", "params": {"table": "cast_info", "columns": ["movie_id", "person_id"]}, "reversible": true}, "proposer_reasoning": "The cast_info table (300k rows, no secondary indexes yet) is a critical join point between title and name. A composite index on (movie_id, person_id) will accelerate the most common join patterns in OLTP workloads while remaining fully reversible in this calm, stable regime.", "pore": "auto_safe", "risk_level": "low", "escalated": false, "human_judge": null, "human_decision": null, "human_rationale": null, "baseline_p99": 39.288, "candidate_p99": 39.288, "within_noise": false, "decision": "keep", "proposer_tokens": {"input_tokens": 1376, "output_tokens": 168}, "human_tokens": {}}
{"style": "linear_ramp", "iteration": 2, "drift": 0.1053, "regime": "calm", "model": "claude-haiku-4-5", "candidate": {"type": "index", "params": {"table": "cast_info", "columns": ["person_id", "movie_id", "role_id"]}, "reversible": true}, "proposer_reasoning": "The workload is read-heavy OLTP with stable patterns. While the problem query on `title(production_year)` has already been indexed, `cast_info` at 300k rows is the largest join target. A covering index on `(person_id, movie_id, role_id)` will accelerate common join patterns and filtering on person_id while allowing index-only scans, reducing disk I/O for the dominant access path.", "pore": "auto_safe", "risk_level": "low", "escalated": false, "human_judge": null, "human_decision": null, "human_rationale": null, "baseline_p99": 26.062, "candidate_p99": 26.062, "within_noise": false, "decision": "keep", "proposer_tokens": {"input_tokens": 1404, "output_tokens": 212}, "human_tokens": {}}
{"style": "linear_ramp", "iteration": 3, "drift": 0.1579, "regime": "calm", "model": "claude-haiku-4-5", "candidate": {"type": "index", "params": {"table": "movie_keyword", "columns": ["movie_id", "keyword_id"]}, "reversible": true}, "proposer_reasoning": "The read-heavy OLTP workload likely includes common joins between title → movie_keyword → keyword to filter or retrieve films by keyword. A composite index on (movie_id, keyword_id) will accelerate keyword-based lookups and joins, addressing the remaining secondary index gaps in the schema while staying reversible.", "pore": "auto_safe", "risk_level": "low", "escalated": false, "human_judge": null, "human_decision": null, "human_rationale": null, "baseline_p99": 17.082, "candidate_p99": 17.082, "within_noise": false, "decision": "keep", "proposer_tokens": {"input_tokens": 1438, "output_tokens": 170}, "human_tokens": {}}
{"style": "linear_ramp", "iteration": 4, "drift": 0.2105, "regime": "calm", "model": "claude-haiku-4-5", "candidate": {"type": "index", "params": {"table": "title", "columns": ["kind_id", "production_year"]}, "reversible": true}, "proposer_reasoning": "The existing single-column index on production_year helps the range scan, but filtering on kind_id (a common join/filter column for title lookups) alongside production_year creates a multi-predicate query pattern. A composite index on (kind_id, production_year) will enable index-only or index-assisted execution for queries filtering on both columns, reducing p99 latency for the stable read-heavy OLTP workload without touching query logic.", "pore": "auto_safe", "risk_level": "low", "escalated": false, "human_judge": null, "human_decision": null, "human_rationale": null, "baseline_p99": 11.027, "candidate_p99": 11.027, "within_noise": false, "decision": "keep", "proposer_tokens": {"input_tokens": 1466, "output_tokens": 214}, "human_tokens": {}}
{"style": "linear_ramp", "iteration": 5, "drift": 0.2632, "regime": "calm", "model": "claude-haiku-4-5", "candidate": {"type": "statistics", "params": {"table": "title", "columns": ["kind_id", "production_year"]}, "reversible": true}, "proposer_reasoning": "An index on (kind_id, production_year) already exists, but creating extended statistics over these correlated columns will help the planner make more accurate cardinality estimates for queries filtering or joining on both columns together. This is especially valuable for the read-heavy OLTP workload where the planner may otherwise underestimate or overestimate selectivity when both columns are involved in predicates.", "pore": "auto_safe", "risk_level": "low", "escalated": false, "human_judge": null, "human_decision": null, "human_rationale": null, "baseline_p99": 10.763, "candidate_p99": 10.763, "within_noise": false, "decision": "keep", "proposer_tokens": {"input_tokens": 1492, "output_tokens": 200}, "human_tokens": {}}
{"style": "linear_ramp", "iteration": 6, "drift": 0.3158, "regime": "shifting", "model": "claude-haiku-4-5", "candidate": {"type": "statistics", "params": {"table": "cast_info", "columns": ["movie_id", "person_id"]}, "reversible": true}, "proposer_reasoning": "The problem query filters title by production_year and joins to cast_info on movie_id. The planner's row-count estimate for cast_info after the join is likely poor because it doesn't understand the correlation between movie_id and person_id cardinality—especially as the analytical scan mix increases. Extended statistics on (movie_id, person_id) will teach the planner that these columns are correlated, eliminating the plan flip and stabilizing estimates across the shifting workload.", "pore": "auto_safe", "risk_level": "low", "escalated": false, "human_judge": null, "human_decision": null, "human_rationale": null, "baseline_p99": 10.763, "candidate_p99": 10.512, "within_noise": true, "decision": "discard", "proposer_tokens": {"input_tokens": 1552, "output_tokens": 222}, "human_tokens": {}}
{"style": "linear_ramp", "iteration": 7, "drift": 0.3684, "regime": "shifting", "model": "claude-haiku-4-5", "candidate": {"type": "statistics", "params": {"table": "title", "columns": ["production_year", "id"]}, "reversible": true}, "proposer_reasoning": "The query filters on production_year and then joins to cast_info via t.id. Bad row-count estimates on the filtered title set directly cascade into incorrect estimates of the cast_info join cardinality. Extended statistics on (production_year, id) will help the planner accurately predict how many rows survive the BETWEEN 2000 AND 2010 filter and thus how many will match in cast_info, eliminating the plan-flip risk.", "pore": "auto_safe", "risk_level": "low", "escalated": false, "human_judge": null, "human_decision": null, "human_rationale": null, "baseline_p99": 10.763, "candidate_p99": 10.523, "within_noise": true, "decision": "discard", "proposer_tokens": {"input_tokens": 1552, "output_tokens": 211}, "human_tokens": {}}
{"style": "linear_ramp", "iteration": 8, "drift": 0.4211, "regime": "shifting", "model": "claude-haiku-4-5", "candidate": {"type": "statistics", "params": {"table": "cast_info", "columns": ["movie_id", "role_id"]}, "reversible": true}, "proposer_reasoning": "The problem query joins title (filtered by production_year 2000–2010) to cast_info on movie_id, then groups by t.id. The bad row-count estimate stems from the planner not knowing the correlation between movie_id (which varies with production_year via the implicit join selectivity) and role_id (which has its own cardinality). Extended statistics on (movie_id, role_id) will help the planner understand the true join cardinality and avoid plan flips when analytical scans appear alongside this correlated filtering pattern.", "pore": "auto_safe", "risk_level": "low", "escalated": false, "human_judge": null, "human_decision": null, "human_rationale": null, "baseline_p99": 10.763, "candidate_p99": 10.248, "within_noise": true, "decision": "discard", "proposer_tokens": {"input_tokens": 1552, "output_tokens": 239}, "human_tokens": {}}
{"style": "linear_ramp", "iteration": 9, "drift": 0.4737, "regime": "shifting", "model": "claude-haiku-4-5", "candidate": {"type": "statistics", "params": {"table": "title", "columns": ["id", "production_year"]}, "reversible": true}, "proposer_reasoning": "The query filters on production_year then joins to cast_info—the planner's row-count estimate for the filtered title set directly drives downstream cardinality. Extended statistics on (id, production_year) will capture the correlation between the PK and the filter column, improving join cardinality estimates and reducing plan instability in this drifting analytical workload.", "pore": "auto_safe", "risk_level": "low", "escalated": false, "human_judge": null, "human_decision": null, "human_rationale": null, "baseline_p99": 10.763, "candidate_p99": 10.477, "within_noise": true, "decision": "discard", "proposer_tokens": {"input_tokens": 1552, "output_tokens": 191}, "human_tokens": {}}
{"style": "linear_ramp", "iteration": 10, "drift": 0.5263, "regime": "shifting", "model": "claude-haiku-4-5", "candidate": {"type": "statistics", "params": {"table": "cast_info", "columns": ["movie_id", "nr_order"]}, "reversible": true}, "proposer_reasoning": "The problem query joins title (filtered by production_year) with cast_info on movie_id, then groups by t.id and counts rows. Bad row-count estimates suggest the planner underestimates how many cast_info rows map to each filtered movie. Extended statistics on cast_info(movie_id, nr_order) will help the planner understand the distribution and cardinality of cast_info rows per movie, especially under the correlated filtering now appearing in the shifting workload. This is reversible, directly addresses the estimation gap in the join, and is more targeted than a blanket GUC change.", "pore": "auto_safe", "risk_level": "low", "escalated": false, "human_judge": null, "human_decision": null, "human_rationale": null, "baseline_p99": 10.763, "candidate_p99": 10.464, "within_noise": true, "decision": "discard", "proposer_tokens": {"input_tokens": 1552, "output_tokens": 250}, "human_tokens": {}}
{"style": "linear_ramp", "iteration": 11, "drift": 0.5789, "regime": "shifting", "model": "claude-haiku-4-5", "candidate": {"type": "statistics", "params": {"table": "title", "columns": ["production_year", "id"]}, "reversible": true}, "proposer_reasoning": "The query filters on production_year and joins to cast_info, then counts grouped by t.id. Bad rowcount estimates on the title side of the join stem from the planner not understanding correlation between the year range and the cardinality of matching titles. Extended statistics on (production_year, id) will help the planner estimate how many rows pass the filter and feed into the GROUP BY, fixing plan flips under workload drift.", "pore": "auto_safe", "risk_level": "low", "escalated": false, "human_judge": null, "human_decision": null, "human_rationale": null, "baseline_p99": 10.763, "candidate_p99": 10.07, "within_noise": true, "decision": "discard", "proposer_tokens": {"input_tokens": 1552, "output_tokens": 206}, "human_tokens": {}}
{"style": "linear_ramp", "iteration": 12, "drift": 0.6316, "regime": "turbulent", "model": "claude-haiku-4-5", "candidate": {"type": "guc", "params": {"name": "work_mem", "value": "256MB"}, "reversible": true}, "proposer_reasoning": "Hash joins are spilling to disk under concurrent write bursts; boosting work_mem reduces spill overhead and stabilizes join performance. This is a session-level tuning lever that addresses the immediate symptom (hash join thrashing) without reshaping global behaviour or requiring a service bounce.", "pore": "auto_safe", "risk_level": "low", "escalated": false, "human_judge": null, "human_decision": null, "human_rationale": null, "baseline_p99": 9.308, "candidate_p99": 9.308, "within_noise": false, "decision": "keep", "proposer_tokens": {"input_tokens": 1558, "output_tokens": 158}, "human_tokens": {}}
{"style": "linear_ramp", "iteration": 13, "drift": 0.6842, "regime": "turbulent", "model": "claude-haiku-4-5", "candidate": {"type": "guc", "params": {"name": "random_page_cost", "value": "1.1"}, "reversible": true}, "proposer_reasoning": "Under write-heavy bursts with plan regressions on multi-table joins, the planner is likely overestimating sequential scan costs relative to index scans, causing it to flip between plans when buffer utilization and cardinality estimates drift. Lowering random_page_cost from the default 4.0 to 1.1 reflects modern SSD-backed storage and makes the planner more aggressive about using the already-deployed indexes (cast_info, movie_keyword, title), reducing hash join spills and stabilizing plan choice under memory pressure and connection churn.", "pore": "auto_safe", "risk_level": "low", "escalated": false, "human_judge": null, "human_decision": null, "human_rationale": null, "baseline_p99": 8.612, "candidate_p99": 8.612, "within_noise": false, "decision": "keep", "proposer_tokens": {"input_tokens": 1579, "output_tokens": 225}, "human_tokens": {}}
{"style": "linear_ramp", "iteration": 14, "drift": 0.7368, "regime": "turbulent", "model": "claude-haiku-4-5", "candidate": {"type": "guc", "params": {"name": "join_collapse_limit", "value": "8"}, "reversible": true}, "proposer_reasoning": "Plan regressions on 5-table joins under write-heavy churn indicate the planner is exploring suboptimal join orders due to cartesian-product estimation errors or exhausted heuristics. Lowering join_collapse_limit from the default 12 forces the planner to use GEQO (genetic query optimizer) earlier and more conservatively, stabilizing join order decisions and reducing the variance that causes hash-join spills and p99 latency flare-ups during turbulent drift.", "pore": "auto_safe", "risk_level": "low", "escalated": false, "human_judge": null, "human_decision": null, "human_rationale": null, "baseline_p99": 8.612, "candidate_p99": 8.015, "within_noise": true, "decision": "discard", "proposer_tokens": {"input_tokens": 1603, "output_tokens": 200}, "human_tokens": {}}
{"style": "linear_ramp", "iteration": 15, "drift": 0.7895, "regime": "turbulent", "model": "claude-haiku-4-5", "candidate": {"type": "guc", "params": {"name": "jit", "value": "off"}, "reversible": true}, "proposer_reasoning": "In a turbulent, write-heavy regime with plan regressions and hash-join spilling under concurrent load, JIT compilation overhead (CPU and memory contention) is exacerbating latency variance and p99 jitter. Disabling JIT removes compilation storms during burst workloads while preserving planner correctness, trading modest throughput for stability—critical for p99 under drift=0.79.", "pore": "auto_safe", "risk_level": "low", "escalated": false, "human_judge": null, "human_decision": null, "human_rationale": null, "baseline_p99": 8.612, "candidate_p99": 8.473, "within_noise": true, "decision": "discard", "proposer_tokens": {"input_tokens": 1603, "output_tokens": 186}, "human_tokens": {}}
{"style": "linear_ramp", "iteration": 16, "drift": 0.8421, "regime": "turbulent", "model": "claude-haiku-4-5", "candidate": {"type": "guc", "params": {"name": "jit", "value": "off"}, "reversible": true}, "proposer_reasoning": "Under turbulent write-heavy workload with plan regressions and hash-join spilling, JIT compilation overhead during burst periods exacerbates latency variance and destabilizes plan choice timing. Disabling JIT eliminates per-query compilation cost, stabilizes executor predictability, and frees planner resources under connection churn.", "pore": "auto_safe", "risk_level": "low", "escalated": false, "human_judge": null, "human_decision": null, "human_rationale": null, "baseline_p99": 7.641, "candidate_p99": 7.641, "within_noise": false, "decision": "keep", "proposer_tokens": {"input_tokens": 1603, "output_tokens": 174}, "human_tokens": {}}
{"style": "linear_ramp", "iteration": 17, "drift": 0.8947, "regime": "regime_break", "model": "claude-haiku-4-5", "candidate": {"type": "guc", "params": {"name": "synchronous_commit", "value": "off"}, "reversible": true}, "proposer_reasoning": "Under regime_break with 10x p99 spike driven by interleaved OLTP+OLAP storms, the bulk inserts are likely stalling on WAL synchronization. Disabling synchronous_commit removes the durability bottleneck during high-concurrency mixed workloads, trading write durability guarantees (acceptable in this operational emergency) for immediate latency relief on the hot path. This is systemic, reversible, and directly addresses the spike's root cause.", "pore": "blast_radius", "risk_level": "high", "escalated": true, "human_judge": "claude-sonnet-4-6", "human_decision": "approve", "human_rationale": "This is a genuinely defensible call under the current conditions, and I'm approving with eyes open. The change — setting synchronous_commit=off — is a well-understood PostgreSQL GUC that trades crash-safety of the most recent ~1 commit-cycle of writes (typically <200ms of WAL) for a substantial reduction in write latency and I/O pressure on the WAL subsystem. Critically: (1) It is fully reversible at any time with a single SET command or config reload — no data migration, no schema change, no downtime required. (2) It does NOT risk data corruption or violate ACID isolation; it only opens a small window of potential data loss on a hard crash (not a clean shutdown), which is a known, documented, and widely accepted trade-off in high-throughput OLTP workloads. (3) The current regime is unprecedented (drift=0.89), p99 is spiking ~10x, and targeted index tuning has already been attempted without relief — this strongly suggests WAL flush latency is a bottleneck contributing to the spike. Turning off synchronous_commit is a standard, low-risk lever for exactly this scenario. (4) Blast radius is flagged as high because of the systemic scope (all writes cluster-wide), but the actual worst-case consequence is bounded and well-understood: a small, quantifiable window of data loss on a server crash — not cascading failure, not data corruption, not availability loss. Given the severity of the ongoing incident, the reversibility, and the bounded worst-case risk, the expected benefit clearly justifies the change. Recommend the on-call team document the window of exposure, alert the application and data owners of the trade-off, and schedule re-evaluation of re-enabling synchronous_commit once the incident is resolved and root cause is understood.", "baseline_p99": null, "candidate_p99": null, "within_noise": null, "decision": "escalated", "proposer_tokens": {"input_tokens": 1683, "output_tokens": 202}, "human_tokens": {"input_tokens": 981, "output_tokens": 454}}
