{"style": "oscillating", "iteration": 13, "drift": 0.8804, "regime": "regime_break", "model": "claude-sonnet-4-6", "candidate": {"type": "guc", "params": {"name": "full_page_writes", "value": "off", "blast_radius": "high"}, "reversible": true}, "proposer_reasoning": "In a mixed OLTP+OLAP bulk-insert storm, full_page_writes is the single largest source of WAL write amplification: every first write to a page after a checkpoint emits the entire 8 kB page into WAL, not just the delta. With heavy concurrent inserts this multiplies WAL I/O 4–8× and is the dominant driver of the 80 ms→900 ms p99 oscillation that correlates with checkpoint cycles. Turning it off eliminates that write amplification immediately and system-wide, collapsing WAL bandwidth and reducing fsync pressure without touching durability at the transaction-commit level (synchronous_commit=off already escalated covers commit latency). The risk — partial-page corruption if the OS/storage layer tears a write during a crash — is real but bounded: a clean shutdown or a crash followed by restore-from-basebackup recovers fully, and the change is a single `SET` away from reversal.", "pore": "blast_radius", "risk_level": "high", "escalated": true, "human_judge": "claude-sonnet-4-6", "human_decision": "reject", "human_rationale": "I am rejecting this change. Setting `full_page_writes = off` is one of the most dangerous GUC changes available in PostgreSQL. While it is technically reversible (a `SET` or `postgresql.conf` change + reload/restart), the window of irreversible harm is enormous: if the instance crashes or loses power at any point after the change is applied and before a clean checkpoint cycle completes — and especially during this period of unprecedented, high-stress workload — partial page writes can silently corrupt heap and index pages in ways that may not surface until much later, at which point the damage is unrecoverable without a clean backup restore. The \"reversible\" label here is misleading in practice: you can flip the GUC back, but you cannot un-corrupt pages that were partially written during the window it was off. The blast radius is correctly rated high — this touches every write path across every table and index in the cluster. The current regime context (drift=0.88, regime_break, p99 spiking 10x) actually makes this *more* dangerous, not less: an unprecedented workload is exactly the scenario most likely to induce a crash or I/O error during the exposure window. The proposed performance benefit (reduced WAL volume / write amplification) does not justify the existential data-integrity risk during an already-unstable incident. The right path forward is: (1) identify and shed the specific query patterns driving the p99 spike via `pg_stat_activity` / `pg_stat_statements`, (2) consider `max_parallel_workers`, `work_mem`, or connection pooling tuning, (3) evaluate a read replica or PgBouncer offload, and (4) only consider storage-layer WAL optimizations (e.g., `synchronous_commit = local` or `off` for non-critical writes) after scoping the risk to specific workloads — never disable full_page_writes on a live, stressed production cluster.", "baseline_p99": null, "candidate_p99": null, "within_noise": null, "decision": "escalated", "proposer_tokens": {"input_tokens": 1959, "output_tokens": 330}, "human_tokens": {"input_tokens": 992, "output_tokens": 483}}
{"style": "oscillating", "iteration": 14, "drift": 0.7351, "regime": "turbulent", "model": "claude-sonnet-4-6", "candidate": {"type": "statistics", "params": {"table": "cast_info", "columns": ["movie_id", "role_id"]}, "reversible": true}, "proposer_reasoning": "The 5-table join pivots on cast_info as the hub, and the planner is flip-flopping between plans because it cannot accurately estimate the joint selectivity of movie_id and role_id together — leading to bad row-count estimates that cause hash joins to spill or the planner to switch strategies between runs. Extended statistics over these two correlated columns give the planner a much tighter ndistinct/MCV picture of their joint distribution, stabilising row estimates mid-join and eliminating the plan regressions without touching any GUC or taking any locks beyond a brief ANALYZE pass.", "pore": "auto_safe", "risk_level": "low", "escalated": false, "human_judge": null, "human_decision": null, "human_rationale": null, "baseline_p99": 17.642, "candidate_p99": 19.332, "within_noise": true, "decision": "rollback", "proposer_tokens": {"input_tokens": 1932, "output_tokens": 239}, "human_tokens": {}}
{"style": "oscillating", "iteration": 15, "drift": 0.5, "regime": "shifting", "model": "claude-sonnet-4-6", "candidate": {"type": "statistics", "params": {"table": "cast_info", "columns": ["movie_id", "role_id"]}, "reversible": true}, "proposer_reasoning": "The query joins cast_info to title on movie_id and the planner is producing bad row-count estimates — a classic symptom of correlated columns inside cast_info (movie_id and role_id co-vary: certain films have far more cast entries of particular role types than the independence assumption implies). Extended statistics over (movie_id, role_id) gives the planner an MCV/dependency model for this pair, fixing the estimate at the join and preventing plan flips as the analytical scan mix drifts further. An index on movie_id already exists, so this purely improves cardinality estimation without touching I/O costs or any other session.", "pore": "auto_safe", "risk_level": "low", "escalated": false, "human_judge": null, "human_decision": null, "human_rationale": null, "baseline_p99": 17.16, "candidate_p99": 17.16, "within_noise": false, "decision": "keep", "proposer_tokens": {"input_tokens": 1926, "output_tokens": 250}, "human_tokens": {}}
{"style": "oscillating", "iteration": 16, "drift": 0.2649, "regime": "calm", "model": "claude-sonnet-4-6", "candidate": {"type": "index", "params": {"table": "cast_info", "columns": ["role_id"]}, "reversible": true}, "proposer_reasoning": "The workload is read-heavy OLTP with cast_info as the central join hub. Indexes on movie_id and person_id are already in place, leaving role_id as the remaining unindexed filter/join column on cast_info. Adding an index on role_id allows the planner to perform index scans when queries filter by role (e.g., actor vs. director lookups), eliminating residual sequential scans on the ~300k-row table and reducing p99 latency for those SELECTs.", "pore": "auto_safe", "risk_level": "low", "escalated": false, "human_judge": null, "human_decision": null, "human_rationale": null, "baseline_p99": 12.179, "candidate_p99": 12.179, "within_noise": false, "decision": "keep", "proposer_tokens": {"input_tokens": 1920, "output_tokens": 216}, "human_tokens": {}}
{"style": "oscillating", "iteration": 17, "drift": 0.1196, "regime": "calm", "model": "claude-sonnet-4-6", "candidate": {"type": "index", "params": {"table": "cast_info", "columns": ["nr_order"]}, "reversible": true}, "proposer_reasoning": "All obvious filter/join columns on cast_info (movie_id, person_id, role_id) are already indexed. The remaining unindexed column used in ORDER BY / filter clauses in typical OLTP cast queries is nr_order — a secondary index here eliminates the last sequential-scan path on cast_info for queries that sort or filter by billing/credit order, directly reducing p99 for those SELECTs without any blast radius.", "pore": "auto_safe", "risk_level": "low", "escalated": false, "human_judge": null, "human_decision": null, "human_rationale": null, "baseline_p99": 7.865, "candidate_p99": 7.865, "within_noise": false, "decision": "keep", "proposer_tokens": {"input_tokens": 1942, "output_tokens": 197}, "human_tokens": {}}
{"style": "oscillating", "iteration": 18, "drift": 0.1196, "regime": "calm", "model": "claude-sonnet-4-6", "candidate": {"type": "index", "params": {"table": "title", "columns": ["kind_id", "production_year"]}, "reversible": true}, "proposer_reasoning": "The title table is already indexed on production_year alone, but queries that filter on both production_year and kind_id (a very common OLTP pattern given the schema and the existing correlated statistics on those two columns) cannot benefit from an index-only or composite scan. A composite index on (kind_id, production_year) lets the planner do an efficient index range scan when both predicates are present, and still serves kind_id equality lookups independently — complementing rather than duplicating the existing single-column production_year index. This is the last high-value, fully reversible secondary index remaining on the title table's most-queried filter columns.", "pore": "auto_safe", "risk_level": "low", "escalated": false, "human_judge": null, "human_decision": null, "human_rationale": null, "baseline_p99": 5.042, "candidate_p99": 5.042, "within_noise": false, "decision": "keep", "proposer_tokens": {"input_tokens": 1964, "output_tokens": 246}, "human_tokens": {}}
{"style": "oscillating", "iteration": 19, "drift": 0.2649, "regime": "calm", "model": "claude-sonnet-4-6", "candidate": {"type": "index", "params": {"table": "title", "columns": ["production_year", "id"]}, "reversible": true}, "proposer_reasoning": "The problem query `SELECT * FROM title WHERE production_year BETWEEN 2000 AND 2010` is still doing a sequential scan. A plain B-tree index on `production_year` alone was already applied but the planner may prefer a covering index that includes `id` (the PK) to enable an index-only scan, avoiding heap fetches entirely for range predicates on this read-heavy workload. This is a narrowly targeted, fully reversible fix with no cross-table blast radius.", "pore": "auto_safe", "risk_level": "low", "escalated": false, "human_judge": null, "human_decision": null, "human_rationale": null, "baseline_p99": 3.553, "candidate_p99": 3.553, "within_noise": false, "decision": "keep", "proposer_tokens": {"input_tokens": 1990, "output_tokens": 212}, "human_tokens": {}}