{"style": "oscillating", "iteration": 1, "drift": 0.7351, "regime": "turbulent", "model": "claude-sonnet-4-6", "candidate": {"type": "guc", "params": {"name": "work_mem", "value": "64MB", "blast_radius": "high"}, "reversible": true}, "proposer_reasoning": "Hash joins are explicitly spilling to disk on the 5-table join, and single-column indexes have been exhausted — the bottleneck is insufficient per-sort/hash memory. Raising work_mem from the default 4 MB to 64 MB gives each hash batch enough RAM to stay in memory, eliminating spill I/O and stabilising the hash-join cost estimates that are causing plan regressions between runs. This is the highest-leverage remaining lever: it directly attacks both the spill latency and the plan instability without a service bounce, though it reshapes behaviour for every concurrent session (blast_radius: high).", "pore": "blast_radius", "risk_level": "high", "escalated": true, "human_judge": "claude-sonnet-4-6", "human_decision": "approve", "human_rationale": "This is a reversible GUC change (work_mem 64MB), so it can be rolled back immediately if conditions worsen — that materially reduces the risk despite the high blast-radius flag. The operating context makes a strong case for it: the system is in a turbulent, write-heavy, connection-churn regime with confirmed plan regressions on multi-table joins, and single-column indexes have already been exhausted as a lever. These are textbook symptoms of hash-join and sort operations spilling to disk due to insufficient work_mem, causing planner cost misestimates that cascade into the regressions we're seeing. Raising work_mem from its likely default (4MB) to 64MB is a well-understood, commonly applied remedy for this exact pattern. The blast radius concern is real: work_mem is per-sort-operation per-connection, so under high connection churn, total memory consumption could be (connections × concurrent sorts × 64MB) — this must be validated against available RAM before or immediately after applying. If the server has, say, ≥32GB RAM and connection count is bounded (e.g., via a pooler), the aggregate ceiling stays manageable. The change should be applied at the session or role level first if possible (SET work_mem = '64MB' for the query workload in question), and promoted to postgresql.conf only after confirming p99 improvement without OOM pressure. Given reversibility, the clear diagnostic alignment, and the fact that the optimizer has already exhausted lower-risk options, approving is the right, defensible call — but the on-call engineer must immediately monitor total shared memory usage and pg_stat_activity for connection count spikes, with a rollback trigger defined (e.g., free memory < 20% or OOM killer activity).", "baseline_p99": null, "candidate_p99": null, "within_noise": null, "decision": "escalated", "proposer_tokens": {"input_tokens": 1423, "output_tokens": 252}, "human_tokens": {"input_tokens": 989, "output_tokens": 443}}
{"style": "oscillating", "iteration": 2, "drift": 0.8804, "regime": "regime_break", "model": "claude-sonnet-4-6", "candidate": {"type": "guc", "params": {"name": "synchronous_commit", "value": "off", "blast_radius": "high"}, "reversible": true}, "proposer_reasoning": "The OLTP+OLAP storm's p99 oscillation (80ms→900ms) is driven by bulk inserts serializing on WAL fsync latency — each commit waits for the OS to flush WAL, stalling the concurrent OLAP join. Setting synchronous_commit=off eliminates per-commit WAL flush round-trips (WAL is still written, just not fsynced synchronously), collapsing insert commit latency by 1–2 orders of magnitude and freeing I/O headroom for the analytic queries; the only tradeoff is up to ~wal_writer_delay (200ms) of data loss on a hard crash, with no risk of corruption or inconsistency.", "pore": "blast_radius", "risk_level": "high", "escalated": true, "human_judge": "claude-sonnet-4-6", "human_decision": "approve", "human_rationale": "This is a defensible approval under the current circumstances, with clear eyes on the tradeoffs. The change — setting synchronous_commit=off — is a well-understood PostgreSQL GUC that trades durability (up to ~1 write-ahead log flush cycle, typically ~200ms of committed transactions) for dramatically reduced write latency and I/O pressure. Critically, it is fully reversible with a single GUC reset and does not risk data corruption or structural damage; the worst-case failure scenario is losing a small window of recently-committed transactions in a hard crash, not data inconsistency or table/index damage. Given the operating context: (1) drift=0.88 signals a genuine regime break where historical baselines are unreliable, making inaction itself a high-risk choice as p99 spiking ~10x indicates the system is actively degrading; (2) targeted indexes have already been tried and failed to resolve the issue, suggesting write I/O saturation or WAL pressure is the bottleneck, which synchronous_commit=off directly addresses; (3) the change is session- or system-level settable and can be reverted in seconds without downtime or a migration. The blast radius is legitimately \"high\" in the sense that it affects all writes system-wide and introduces a narrow durability window, so the gate flag is appropriate — but high blast radius here means wide positive impact, not wide destructive impact. Teams must be notified immediately of the reduced durability guarantee so application owners can assess acceptability, and this should be treated as a temporary stabilization measure with a defined review window (e.g., 2 hours) to evaluate whether the root cause can be addressed more permanently once the bleeding stops.", "baseline_p99": null, "candidate_p99": null, "within_noise": null, "decision": "escalated", "proposer_tokens": {"input_tokens": 1549, "output_tokens": 273}, "human_tokens": {"input_tokens": 991, "output_tokens": 423}}
{"style": "oscillating", "iteration": 3, "drift": 0.8804, "regime": "regime_break", "model": "claude-sonnet-4-6", "candidate": {"type": "migration", "params": {"table": "cast_info", "op": "VACUUM FULL", "detail": "VACUUM FULL cast_info; -- followed by ANALYZE cast_info. The ~300k-row table has no secondary indexes and is the join hub for the 5-table OLAP query while simultaneously receiving bulk inserts. Bloat from the mixed OLTP+OLAP storm is causing sequential scans to read far more pages than the logical row count requires, inflating p99 scan cost every run. A VACUUM FULL rewrites the heap to a compact, contiguous layout, shrinks the relation on disk, improves buffer-cache hit rate, and resets the visibility map so future index-only scans (once indexes exist) can proceed without heap fetches. Because the table has no secondary indexes yet, the rewrite lock window is minimised compared to an indexed table."}, "reversible": false}, "proposer_reasoning": "With every targeted index and GUC lever either applied or under human review, the remaining systemic cause of p99 oscillation on cast_info is table bloat: interleaved bulk inserts and long-running OLAP scans produce dead tuples and fragmented pages that balloon sequential-scan I/O each run. A VACUUM FULL compacts the heap in one decisive rewrite, directly shrinking the scan footprint for the dominant join path and eliminating the run-to-run variance caused by bloat accumulation.", "pore": "reversibility", "risk_level": "high", "escalated": true, "human_judge": "claude-sonnet-4-6", "human_decision": "reject", "human_rationale": "VACUUM FULL acquires an ACCESS EXCLUSIVE lock on `cast_info` for the entire duration of the rewrite — blocking ALL reads and writes, including the bulk inserts and OLAP queries that are already under severe stress. In a regime_break scenario (drift=0.88) where p99 is already spiking 10x, taking the join-hub table fully offline for the duration of a heap rewrite is extremely likely to turn a bad situation into a complete outage: queues back up, bulk insert pipelines stall, and every OLAP query that touches this table returns errors or times out. The proposed justification (no secondary indexes minimizes the lock window) is technically true but misleading — even without indexes the rewrite of a 300k-row table under concurrent heavy load can take tens of seconds to minutes, and the ACCESS EXCLUSIVE lock is held from the very first moment. The change is also irreversible in the sense that once the lock storm and downstream cascade begin there is no rollback. A safer, non-locking alternative exists right now: a standard `VACUUM ANALYZE cast_info` (no FULL) reclaims dead tuples and updates statistics without an exclusive lock, meaningfully reducing bloat-driven scan amplification while the table stays online. If a full compaction is genuinely needed it should be scheduled in a controlled maintenance window with bulk inserts paused and OLAP traffic rerouted — not executed during an active p99 crisis in an unprecedented workload regime. Rejecting until a maintenance window and traffic-diversion plan are in place.", "baseline_p99": null, "candidate_p99": null, "within_noise": null, "decision": "escalated", "proposer_tokens": {"input_tokens": 1581, "output_tokens": 396}, "human_tokens": {"input_tokens": 1159, "output_tokens": 392}}
{"style": "oscillating", "iteration": 4, "drift": 0.7351, "regime": "turbulent", "model": "claude-sonnet-4-6", "candidate": {"type": "statistics", "params": {"table": "cast_info", "columns": ["movie_id", "person_id"]}, "reversible": true}, "proposer_reasoning": "The 5-table join pivots on cast_info as the central hub, joining both to title (via movie_id) and name (via person_id). Without multi-column statistics, the planner treats these FK columns as independent, wildly mis-estimating row counts after each join step and flip-flopping between hash and nested-loop plans across runs. Extended statistics on (movie_id, person_id) lets the planner see their joint distribution, stabilising cardinality estimates and eliminating the plan regressions — without touching memory, connections, or any session-global parameter.", "pore": "auto_safe", "risk_level": "low", "escalated": false, "human_judge": null, "human_decision": null, "human_rationale": null, "baseline_p99": 117.592, "candidate_p99": 118.34, "within_noise": true, "decision": "rollback", "proposer_tokens": {"input_tokens": 1722, "output_tokens": 236}, "human_tokens": {}}
{"style": "oscillating", "iteration": 5, "drift": 0.5, "regime": "shifting", "model": "claude-sonnet-4-6", "candidate": {"type": "index", "params": {"table": "cast_info", "columns": ["movie_id"]}, "reversible": true}, "proposer_reasoning": "The query joins cast_info to title on ci.movie_id = t.id after filtering title by production_year (2000–2010). Without an index on cast_info.movie_id, every execution requires a full sequential scan of the ~300k-row heap to find matching rows for each qualifying title. Adding a B-tree index on cast_info(movie_id) lets the planner switch to an index scan or index-only scan for the join lookup, dramatically reducing the rows read and stabilising the row-count estimate that is currently causing plan flips under the shifting analytical workload.", "pore": "auto_safe", "risk_level": "low", "escalated": false, "human_judge": null, "human_decision": null, "human_rationale": null, "baseline_p99": 90.71, "candidate_p99": 90.71, "within_noise": false, "decision": "keep", "proposer_tokens": {"input_tokens": 1716, "output_tokens": 233}, "human_tokens": {}}
{"style": "oscillating", "iteration": 6, "drift": 0.2649, "regime": "calm", "model": "claude-sonnet-4-6", "candidate": {"type": "index", "params": {"table": "title", "columns": ["production_year"]}, "reversible": true}, "proposer_reasoning": "The problem query is a range scan on title.production_year that currently forces a full sequential scan. A B-tree index on that single column lets the planner switch to an index range scan for BETWEEN 2000 AND 2010, directly eliminating the bottleneck with a minimal, reversible, targeted fix that is exactly right for this calm, read-heavy OLTP regime.", "pore": "auto_safe", "risk_level": "low", "escalated": false, "human_judge": null, "human_decision": null, "human_rationale": null, "baseline_p99": 62.462, "candidate_p99": 62.462, "within_noise": false, "decision": "keep", "proposer_tokens": {"input_tokens": 1704, "output_tokens": 184}, "human_tokens": {}}
{"style": "oscillating", "iteration": 7, "drift": 0.1196, "regime": "calm", "model": "claude-sonnet-4-6", "candidate": {"type": "index", "params": {"table": "movie_keyword", "columns": ["movie_id"]}, "reversible": true}, "proposer_reasoning": "With an index already on cast_info(movie_id) and title(production_year), the next join-path bottleneck in this read-heavy OLTP workload is movie_keyword. Queries that filter titles by production_year and then join to movie_keyword will perform a sequential scan on movie_keyword without a secondary index on movie_id. Adding this index completes the indexed join path across the schema's hub tables, directly reducing p99 latency for the problem queries.", "pore": "auto_safe", "risk_level": "low", "escalated": false, "human_judge": null, "human_decision": null, "human_rationale": null, "baseline_p99": 38.439, "candidate_p99": 38.439, "within_noise": false, "decision": "keep", "proposer_tokens": {"input_tokens": 1724, "output_tokens": 203}, "human_tokens": {}}
{"style": "oscillating", "iteration": 8, "drift": 0.1196, "regime": "calm", "model": "claude-sonnet-4-6", "candidate": {"type": "index", "params": {"table": "movie_keyword", "columns": ["keyword_id"]}, "reversible": true}, "proposer_reasoning": "With `movie_keyword.movie_id` already indexed, the remaining unindexed foreign key is `keyword_id`. Queries that filter or join on `keyword_id` (e.g., finding all movies tagged with a specific keyword) will currently perform a sequential scan on `movie_keyword`. A targeted B-tree index on `keyword_id` eliminates that scan, directly reducing p99 latency for keyword-driven lookups without any systemic side effects.", "pore": "auto_safe", "risk_level": "low", "escalated": false, "human_judge": null, "human_decision": null, "human_rationale": null, "baseline_p99": 25.216, "candidate_p99": 25.216, "within_noise": false, "decision": "keep", "proposer_tokens": {"input_tokens": 1746, "output_tokens": 200}, "human_tokens": {}}
{"style": "oscillating", "iteration": 9, "drift": 0.2649, "regime": "calm", "model": "claude-sonnet-4-6", "candidate": {"type": "index", "params": {"table": "cast_info", "columns": ["person_id"]}, "reversible": true}, "proposer_reasoning": "With the movie_id index on cast_info already applied, the next most impactful missing secondary index is on person_id — lookups joining cast_info to the name table (e.g. finding all movies for a given actor) currently require a sequential scan of ~300k rows. A targeted B-tree index on cast_info(person_id) enables index seeks for those name-driven joins, directly cutting p99 for that class of OLTP SELECTs without any systemic side-effects.", "pore": "auto_safe", "risk_level": "low", "escalated": false, "human_judge": null, "human_decision": null, "human_rationale": null, "baseline_p99": 17.642, "candidate_p99": 17.642, "within_noise": false, "decision": "keep", "proposer_tokens": {"input_tokens": 1768, "output_tokens": 214}, "human_tokens": {}}
{"style": "oscillating", "iteration": 10, "drift": 0.5, "regime": "shifting", "model": "claude-sonnet-4-6", "candidate": {"type": "statistics", "params": {"table": "cast_info", "columns": ["movie_id", "role_id"]}, "reversible": true}, "proposer_reasoning": "The query joins cast_info to title on movie_id and the planner is producing bad row-count estimates — the root cause in a shifting/analytical regime is typically column correlation that single-column statistics miss. Extended statistics over (movie_id, role_id) teach the planner the joint distribution of cast_info's two most selectivity-relevant columns, correcting multi-dimensional estimate errors and stabilising plan choice (hash join vs. nested loop) without touching any session-global parameter.", "pore": "auto_safe", "risk_level": "low", "escalated": false, "human_judge": null, "human_decision": null, "human_rationale": null, "baseline_p99": 17.642, "candidate_p99": 17.804, "within_noise": true, "decision": "rollback", "proposer_tokens": {"input_tokens": 1824, "output_tokens": 213}, "human_tokens": {}}
{"style": "oscillating", "iteration": 11, "drift": 0.7351, "regime": "turbulent", "model": "claude-sonnet-4-6", "candidate": {"type": "guc", "params": {"name": "enable_hashjoin", "value": "off", "blast_radius": "high"}, "reversible": true}, "proposer_reasoning": "Hash joins are the confirmed source of p99 pain: they are spilling to disk under memory pressure and flipping plans between runs. Disabling hash joins forces the planner to prefer merge joins or nested-loop joins — both of which have deterministic, non-spilling cost profiles — eliminating the spill-driven latency spikes and the plan instability in a single, instantly-reversible GUC flip. This is the targeted lever that directly attacks the documented symptom without the service-bounce risk of shared_buffers or the durability trade-off of synchronous_commit=off.", "pore": "blast_radius", "risk_level": "high", "escalated": true, "human_judge": "claude-sonnet-4-6", "human_decision": "approve", "human_rationale": "This is a GUC (Grand Unified Configuration) change — setting `enable_hashjoin = off` — which is fully reversible at any time with a single `SET` or `ALTER SYSTEM` command, requiring no schema migration, no data movement, and no downtime. In the described turbulent regime (drift=0.74) with active plan regressions on multi-table joins, disabling hash joins is a well-established emergency tactic: the PostgreSQL planner under memory pressure frequently overestimates hash join performance, leading to spill-to-disk behavior and p99 latency spikes that single-column indexes cannot address. The blast radius is rated high because this affects all queries system-wide, but the reversibility fully counterbalances that risk — if the change worsens latency or throughput, it can be rolled back in seconds. The current regime (write-heavy bursts, connection churn, planner regressions) is precisely the scenario where forcing the planner away from hash joins toward merge or nested-loop strategies is defensible and commonly effective. The expected win — stabilizing p99 on the regressed multi-table join queries — justifies the system-wide scope. Approving with the explicit expectation that on-call monitors p99 and overall QPS for at least 15 minutes post-change and rolls back immediately if aggregate throughput degrades more than 10%.", "baseline_p99": null, "candidate_p99": null, "within_noise": null, "decision": "escalated", "proposer_tokens": {"input_tokens": 1830, "output_tokens": 243}, "human_tokens": {"input_tokens": 991, "output_tokens": 356}}
{"style": "oscillating", "iteration": 12, "drift": 0.8804, "regime": "regime_break", "model": "claude-sonnet-4-6", "candidate": {"type": "guc", "params": {"name": "max_parallel_workers_per_gather", "value": "4", "blast_radius": "high"}, "reversible": true}, "proposer_reasoning": "In an unprecedented regime with a 5-table join storm where all targeted indexes, statistics, work_mem, join strategy, synchronous_commit, and VACUUM FULL have already been escalated, the remaining high-leverage systemic lever is parallelism. The OLAP component of the mixed workload (the 5-table join across cast_info, title, name, keyword, movie_keyword) is almost certainly running serial sequential scans — raising max_parallel_workers_per_gather from the default (2) to 4 allows Postgres to partition those large sequential scans and hash-build phases across multiple workers, directly attacking the p99 spike at its source without touching durability or data semantics.", "pore": "blast_radius", "risk_level": "high", "escalated": true, "human_judge": "claude-sonnet-4-6", "human_decision": "approve", "human_rationale": "This is a GUC (Grand Unified Configuration) change to `max_parallel_workers_per_gather`, raising it to 4. Critically, this change is **fully reversible** — it can be rolled back instantly with a single SET or postgresql.conf edit and reload, with no data mutation risk whatsoever. The blast radius concern here is real but manageable: increasing parallelism can spike CPU and memory usage system-wide if many concurrent queries each spin up 4 workers, potentially causing resource contention under an already-stressed workload. However, the operating context justifies action: we are in a confirmed regime break (drift=0.88, essentially unprecedented territory), p99 latency is spiking ~10x, and targeted index tuning has already been attempted and failed. The workload pattern suggests queries are CPU/IO-bound in a way that sequential execution cannot handle, and parallel query execution is a well-understood lever for exactly this class of problem. A value of 4 is a moderate, reasonable setting (not an extreme outlier), and given the system is already bleeding, the risk of inaction outweighs the risk of this reversible, standard tuning change. I am approving with the expectation that the on-call team monitors CPU saturation, active worker counts, and p99 in the 5–10 minutes post-apply, with a rollback trigger pre-defined if CPU exceeds threshold or latency does not improve within that window.", "baseline_p99": null, "candidate_p99": null, "within_noise": null, "decision": "escalated", "proposer_tokens": {"input_tokens": 1923, "output_tokens": 273}, "human_tokens": {"input_tokens": 995, "output_tokens": 368}}
