{"style": "stationary", "iteration": 23, "drift": 0.15, "regime": "calm", "model": "claude-haiku-4-5", "candidate": {"type": "statistics", "params": {"table": "title", "columns": ["kind_id", "production_year"]}, "reversible": true}, "proposer_reasoning": "An index on production_year alone already exists, but extended statistics on the correlated pair (kind_id, production_year) will improve the planner's cardinality estimation for queries filtering or joining on both columns together. This helps the optimizer choose the best execution plan without adding index overhead.", "pore": "auto_safe", "risk_level": "low", "escalated": false, "human_judge": null, "human_decision": null, "human_rationale": null, "baseline_p99": 1.0, "candidate_p99": 1.034, "within_noise": true, "decision": "rollback", "proposer_tokens": {"input_tokens": 1664, "output_tokens": 177}, "human_tokens": {}}
{"style": "linear_ramp", "iteration": 0, "drift": 0.0, "regime": "calm", "model": "claude-haiku-4-5", "candidate": {"type": "index", "params": {"table": "title", "columns": ["production_year"]}, "reversible": true}, "proposer_reasoning": "The workload shows a direct BETWEEN filter on production_year with no secondary index; adding a B-tree index on this column will allow the planner to use an index range scan instead of a sequential scan, directly eliminating the identified bottleneck in this stable, read-heavy regime.", "pore": "auto_safe", "risk_level": "low", "escalated": false, "human_judge": null, "human_decision": null, "human_rationale": null, "baseline_p99": 66.324, "candidate_p99": 66.324, "within_noise": false, "decision": "keep", "proposer_tokens": {"input_tokens": 1346, "output_tokens": 172}, "human_tokens": {}}
{"style": "linear_ramp", "iteration": 1, "drift": 0.0435, "regime": "calm", "model": "claude-haiku-4-5", "candidate": {"type": "index", "params": {"table": "cast_info", "columns": ["movie_id", "person_id"]}, "reversible": true}, "proposer_reasoning": "The cast_info table (~300k rows) has no secondary indexes yet and is a hot join point between title and name. A composite index on (movie_id, person_id) will accelerate both join lookups and any filtering on these foreign keys, directly reducing latency on common OLTP queries that traverse the cast graph.", "pore": "auto_safe", "risk_level": "low", "escalated": false, "human_judge": null, "human_decision": null, "human_rationale": null, "baseline_p99": 40.514, "candidate_p99": 40.514, "within_noise": false, "decision": "keep", "proposer_tokens": {"input_tokens": 1376, "output_tokens": 173}, "human_tokens": {}}
{"style": "linear_ramp", "iteration": 2, "drift": 0.087, "regime": "calm", "model": "claude-haiku-4-5", "candidate": {"type": "index", "params": {"table": "cast_info", "columns": ["role_id", "nr_order"]}, "reversible": true}, "proposer_reasoning": "The cast_info table (300k rows) lacks secondary indexes on role_id and nr_order, which are common filter/join columns in OLTP workloads. This index will accelerate queries filtering or joining on role assignments and ordering without sequential scan overhead.", "pore": "auto_safe", "risk_level": "low", "escalated": false, "human_judge": null, "human_decision": null, "human_rationale": null, "baseline_p99": 25.264, "candidate_p99": 25.264, "within_noise": false, "decision": "keep", "proposer_tokens": {"input_tokens": 1404, "output_tokens": 159}, "human_tokens": {}}
{"style": "linear_ramp", "iteration": 3, "drift": 0.1304, "regime": "calm", "model": "claude-haiku-4-5", "candidate": {"type": "index", "params": {"table": "movie_keyword", "columns": ["movie_id", "keyword_id"]}, "reversible": true}, "proposer_reasoning": "The cast_info and movie_keyword tables lack a compound index on their join paths. With 300k cast_info rows and no index on (movie_id, keyword_id) in movie_keyword, joins from title to movie_keyword are likely performing full table scans. This index accelerates keyword-based filtering and title–keyword joins, which are common in OLTP workloads querying films by attributes.", "pore": "auto_safe", "risk_level": "low", "escalated": false, "human_judge": null, "human_decision": null, "human_rationale": null, "baseline_p99": 16.633, "candidate_p99": 16.633, "within_noise": false, "decision": "keep", "proposer_tokens": {"input_tokens": 1432, "output_tokens": 192}, "human_tokens": {}}
{"style": "linear_ramp", "iteration": 4, "drift": 0.1739, "regime": "calm", "model": "claude-haiku-4-5", "candidate": {"type": "index", "params": {"table": "cast_info", "columns": ["movie_id", "person_id", "role_id"]}, "reversible": true}, "proposer_reasoning": "The ~300k cast_info table lacks a covering index on its critical query path. A three-column index on (movie_id, person_id, role_id) enables index-only scans for the most common join and filter patterns without table lookups, reducing p99 latency on frequently-accessed casting data.", "pore": "auto_safe", "risk_level": "low", "escalated": false, "human_judge": null, "human_decision": null, "human_rationale": null, "baseline_p99": 11.151, "candidate_p99": 11.151, "within_noise": false, "decision": "keep", "proposer_tokens": {"input_tokens": 1460, "output_tokens": 183}, "human_tokens": {}}
{"style": "linear_ramp", "iteration": 5, "drift": 0.2174, "regime": "calm", "model": "claude-haiku-4-5", "candidate": {"type": "index", "params": {"table": "title", "columns": ["kind_id", "production_year"]}, "reversible": true}, "proposer_reasoning": "The existing single-column index on production_year is now in place, but many OLTP queries likely filter or join on both kind_id and production_year together. A composite index covering both columns will accelerate the most common filter patterns while remaining fully reversible in this calm, stable regime.", "pore": "auto_safe", "risk_level": "low", "escalated": false, "human_judge": null, "human_decision": null, "human_rationale": null, "baseline_p99": 7.436, "candidate_p99": 7.436, "within_noise": false, "decision": "keep", "proposer_tokens": {"input_tokens": 1494, "output_tokens": 169}, "human_tokens": {}}
{"style": "linear_ramp", "iteration": 6, "drift": 0.2609, "regime": "calm", "model": "claude-haiku-4-5", "candidate": {"type": "index", "params": {"table": "title", "columns": ["production_year", "id"]}, "reversible": true}, "proposer_reasoning": "The query `SELECT * FROM title WHERE production_year BETWEEN 2000 AND 2010` is currently seq-scanning despite an existing single-column index on production_year. Adding production_year with id as a covering index enables an index-only scan, eliminating the heap fetch entirely and delivering sub-millisecond p99 latency for this stable, read-heavy workload.", "pore": "auto_safe", "risk_level": "low", "escalated": false, "human_judge": null, "human_decision": null, "human_rationale": null, "baseline_p99": 5.021, "candidate_p99": 5.021, "within_noise": false, "decision": "keep", "proposer_tokens": {"input_tokens": 1520, "output_tokens": 183}, "human_tokens": {}}
{"style": "linear_ramp", "iteration": 7, "drift": 0.3043, "regime": "shifting", "model": "claude-haiku-4-5", "candidate": {"type": "statistics", "params": {"table": "title", "columns": ["production_year", "id"]}, "reversible": true}, "proposer_reasoning": "The problem query filters on production_year (a correlated range) and groups by id—two columns with implicit correlation through the workload structure. Extended statistics will teach the planner that filtering by production_year constrains the id distribution, eliminating bad row-count estimates that cause plan flips under workload drift.", "pore": "auto_safe", "risk_level": "low", "escalated": false, "human_judge": null, "human_decision": null, "human_rationale": null, "baseline_p99": 5.021, "candidate_p99": 5.082, "within_noise": false, "decision": "rollback", "proposer_tokens": {"input_tokens": 1578, "output_tokens": 180}, "human_tokens": {}}
{"style": "linear_ramp", "iteration": 8, "drift": 0.3478, "regime": "shifting", "model": "claude-haiku-4-5", "candidate": {"type": "statistics", "params": {"table": "title", "columns": ["production_year", "id"]}, "reversible": true}, "proposer_reasoning": "The problem query filters on production_year (2000–2010) and groups by title.id; the join to cast_info amplifies cardinality misjudgment. Extended statistics on (production_year, id) will help the planner accurately estimate how many rows survive the year filter and feed into the join, reducing the row-count estimation error that triggers plan flips under workload drift.", "pore": "auto_safe", "risk_level": "low", "escalated": false, "human_judge": null, "human_decision": null, "human_rationale": null, "baseline_p99": 4.849, "candidate_p99": 4.849, "within_noise": false, "decision": "keep", "proposer_tokens": {"input_tokens": 1578, "output_tokens": 200}, "human_tokens": {}}
{"style": "linear_ramp", "iteration": 9, "drift": 0.3913, "regime": "shifting", "model": "claude-haiku-4-5", "candidate": {"type": "statistics", "params": {"table": "cast_info", "columns": ["movie_id", "person_id"]}, "reversible": true}, "proposer_reasoning": "The problem query joins title (filtered by production_year 2000–2010) to cast_info on movie_id, then groups by t.id. Without extended statistics on (movie_id, person_id) in cast_info, the planner lacks correlation awareness between the join key and other attributes, leading to bad row-count estimates that cause plan flips. This is the most direct lever for stabilizing cardinality prediction under the new analytical-scan workload.", "pore": "auto_safe", "risk_level": "low", "escalated": false, "human_judge": null, "human_decision": null, "human_rationale": null, "baseline_p99": 4.849, "candidate_p99": 4.621, "within_noise": true, "decision": "discard", "proposer_tokens": {"input_tokens": 1602, "output_tokens": 219}, "human_tokens": {}}
{"style": "linear_ramp", "iteration": 10, "drift": 0.4348, "regime": "shifting", "model": "claude-haiku-4-5", "candidate": {"type": "statistics", "params": {"table": "cast_info", "columns": ["movie_id", "person_id"]}, "reversible": true}, "proposer_reasoning": "The problem query's bad row-count estimate stems from the join between title (filtered on production_year) and cast_info on movie_id. The planner lacks correlation statistics between movie_id and person_id in cast_info; extended statistics will help it model the selectivity of the join more accurately, reducing plan flips as the workload drifts.", "pore": "auto_safe", "risk_level": "low", "escalated": false, "human_judge": null, "human_decision": null, "human_rationale": null, "baseline_p99": 4.849, "candidate_p99": 4.87, "within_noise": true, "decision": "rollback", "proposer_tokens": {"input_tokens": 1602, "output_tokens": 184}, "human_tokens": {}}
{"style": "linear_ramp", "iteration": 11, "drift": 0.4783, "regime": "shifting", "model": "claude-haiku-4-5", "candidate": {"type": "statistics", "params": {"table": "cast_info", "columns": ["movie_id", "person_id"]}, "reversible": true}, "proposer_reasoning": "The problem query joins title and cast_info on movie_id after filtering title by production_year. Extended statistics on cast_info(movie_id, person_id) will improve the planner's understanding of data distribution and correlation between these frequently-used columns, reducing row-count estimation errors during the join and preventing plan flips as the workload drift introduces analytical scans.", "pore": "auto_safe", "risk_level": "low", "escalated": false, "human_judge": null, "human_decision": null, "human_rationale": null, "baseline_p99": 4.849, "candidate_p99": 4.677, "within_noise": true, "decision": "discard", "proposer_tokens": {"input_tokens": 1602, "output_tokens": 197}, "human_tokens": {}}
{"style": "linear_ramp", "iteration": 12, "drift": 0.5217, "regime": "shifting", "model": "claude-haiku-4-5", "candidate": {"type": "statistics", "params": {"table": "title", "columns": ["production_year", "kind_id"]}, "reversible": true}, "proposer_reasoning": "The problem query filters on production_year (2000–2010 range) and joins to cast_info. The bad row-count estimate stems from the planner not understanding that production_year and kind_id are correlated in the title table—certain kinds (e.g., movies vs. TV episodes) may cluster within particular year ranges. Extended statistics on these two columns will help the planner estimate the filtered subset more accurately, reducing plan flips when analytical scans compete with index-based strategies.", "pore": "auto_safe", "risk_level": "low", "escalated": false, "human_judge": null, "human_decision": null, "human_rationale": null, "baseline_p99": 4.849, "candidate_p99": 4.81, "within_noise": true, "decision": "discard", "proposer_tokens": {"input_tokens": 1602, "output_tokens": 222}, "human_tokens": {}}
{"style": "linear_ramp", "iteration": 13, "drift": 0.5652, "regime": "shifting", "model": "claude-haiku-4-5", "candidate": {"type": "statistics", "params": {"table": "title", "columns": ["production_year", "kind_id"]}, "reversible": true}, "proposer_reasoning": "The query filters on production_year and implicitly correlates with kind_id through the join to cast_info. Creating extended statistics on these two correlated columns in title will help the planner estimate row counts more accurately when both dimensions are involved, reducing plan flips and improving cardinality estimation under the shifting analytical workload.", "pore": "auto_safe", "risk_level": "low", "escalated": false, "human_judge": null, "human_decision": null, "human_rationale": null, "baseline_p99": 4.849, "candidate_p99": 5.048, "within_noise": true, "decision": "rollback", "proposer_tokens": {"input_tokens": 1602, "output_tokens": 184}, "human_tokens": {}}
{"style": "linear_ramp", "iteration": 14, "drift": 0.6087, "regime": "turbulent", "model": "claude-haiku-4-5", "candidate": {"type": "guc", "params": {"name": "work_mem", "value": "256MB"}, "reversible": true}, "proposer_reasoning": "Hash join spilling under write-heavy bursts is causing p99 latency regression on the 5-table join. Increasing work_mem directly reduces spill-to-disk thrashing on intermediate result sets, allowing sorts and hash aggregates to stay in-memory. This is a safe per-session parameter that does not require a service bounce.", "pore": "auto_safe", "risk_level": "low", "escalated": false, "human_judge": null, "human_decision": null, "human_rationale": null, "baseline_p99": 4.272, "candidate_p99": 4.272, "within_noise": false, "decision": "keep", "proposer_tokens": {"input_tokens": 1608, "output_tokens": 172}, "human_tokens": {}}
{"style": "linear_ramp", "iteration": 15, "drift": 0.6522, "regime": "turbulent", "model": "claude-haiku-4-5", "candidate": {"type": "guc", "params": {"name": "random_page_cost", "value": "1.1"}, "reversible": true}, "proposer_reasoning": "Plan regressions on multi-table joins under write-heavy bursts suggest the planner is oscillating between join strategies (nested loop vs. hash) due to stale or unreliable cost estimates. Lowering random_page_cost from the default 4.0 to 1.1 makes the planner more aggressive about index scans and nested loops, stabilizing plans in turbulent conditions where sequential scan cost estimates become unreliable. This directly addresses plan flipping without reshaping session semantics and complements the already-tuned work_mem.", "pore": "auto_safe", "risk_level": "low", "escalated": false, "human_judge": null, "human_decision": null, "human_rationale": null, "baseline_p99": 3.842, "candidate_p99": 3.842, "within_noise": false, "decision": "keep", "proposer_tokens": {"input_tokens": 1629, "output_tokens": 227}, "human_tokens": {}}
{"style": "linear_ramp", "iteration": 16, "drift": 0.6957, "regime": "turbulent", "model": "claude-haiku-4-5", "candidate": {"type": "guc", "params": {"name": "join_collapse_limit", "value": "8"}, "reversible": true}, "proposer_reasoning": "Plan regressions on multi-table joins under turbulent conditions stem from the planner exploring an exponential join-order search space. Reducing join_collapse_limit from the default 8 to prevent subquery flattening of complex CTEs, or in this case, constraining the reorder search depth, forces the planner into a more predictable (and often better-pruned) join order earlier. This directly addresses flapping plans without requiring service-wide memory bounces, and is immediately reversible.", "pore": "auto_safe", "risk_level": "low", "escalated": false, "human_judge": null, "human_decision": null, "human_rationale": null, "baseline_p99": 3.466, "candidate_p99": 3.466, "within_noise": false, "decision": "keep", "proposer_tokens": {"input_tokens": 1653, "output_tokens": 207}, "human_tokens": {}}
{"style": "linear_ramp", "iteration": 17, "drift": 0.7391, "regime": "turbulent", "model": "claude-haiku-4-5", "candidate": {"type": "guc", "params": {"name": "enable_hashagg", "value": "off"}, "reversible": true}, "proposer_reasoning": "Under write-heavy bursts with plan regressions on multi-table joins, hash aggregation is spilling to disk during concurrent workloads and driving p99 latency variance. Disabling it forces the planner toward group aggregates and nested-loop plans that are more predictable under memory pressure and connection churn, trading throughput stability for latency consistency in this turbulent regime.", "pore": "auto_safe", "risk_level": "low", "escalated": false, "human_judge": null, "human_decision": null, "human_rationale": null, "baseline_p99": 3.386, "candidate_p99": 3.386, "within_noise": false, "decision": "keep", "proposer_tokens": {"input_tokens": 1675, "output_tokens": 182}, "human_tokens": {}}
{"style": "linear_ramp", "iteration": 18, "drift": 0.7826, "regime": "turbulent", "model": "claude-haiku-4-5", "candidate": {"type": "guc", "params": {"name": "plan_cache_mode", "value": "force_generic_plan"}, "reversible": true}, "proposer_reasoning": "Under turbulent write-heavy bursts and concurrent connection churn, plan regressions on the 5-table join stem from custom plans flipping across runs as table statistics drift. Forcing generic plans (parameter-driven, prepared-statement style) stabilizes execution paths and eliminates the planner overhead and variance that hash joins are exploiting to spill. This is the highest-leverage systemic lever available without reshaping session behavior.", "pore": "auto_safe", "risk_level": "low", "escalated": false, "human_judge": null, "human_decision": null, "human_rationale": null, "baseline_p99": 3.386, "candidate_p99": 3.195, "within_noise": true, "decision": "discard", "proposer_tokens": {"input_tokens": 1698, "output_tokens": 187}, "human_tokens": {}}
{"style": "linear_ramp", "iteration": 19, "drift": 0.8261, "regime": "turbulent", "model": "claude-haiku-4-5", "candidate": {"type": "statistics", "params": {"table": "cast_info", "columns": ["movie_id", "person_id", "role_id"]}, "reversible": true}, "proposer_reasoning": "Plan regressions on multi-table joins under write-heavy bursts indicate the planner is making poor selectivity estimates on the 3-column composite (movie_id, person_id, role_id) that is heavily filtered and joined. Extended statistics will stabilize cardinality estimates across correlated columns, reducing hash-join spillage and plan flips without touching systemic parameters or adding more indexes.", "pore": "auto_safe", "risk_level": "low", "escalated": false, "human_judge": null, "human_decision": null, "human_rationale": null, "baseline_p99": 3.386, "candidate_p99": 3.437, "within_noise": true, "decision": "rollback", "proposer_tokens": {"input_tokens": 1698, "output_tokens": 209}, "human_tokens": {}}
