{"style": "stationary", "iteration": 0, "drift": 0.15, "regime": "calm", "model": "claude-haiku-4-5", "candidate": {"type": "index", "params": {"table": "title", "columns": ["production_year"]}, "reversible": true}, "proposer_reasoning": "The problem workload is a textbook range query on production_year with no index; a B-tree index on this column will directly eliminate the sequential scan and dramatically reduce p99 latency for this stable, read-heavy OLTP pattern. This is the minimal, reversible lever needed in a calm regime.", "pore": "auto_safe", "risk_level": "low", "escalated": false, "human_judge": null, "human_decision": null, "human_rationale": null, "baseline_p99": 76.445, "candidate_p99": 76.445, "within_noise": false, "decision": "keep", "proposer_tokens": {"input_tokens": 1346, "output_tokens": 168}, "human_tokens": {}}
{"style": "stationary", "iteration": 1, "drift": 0.15, "regime": "calm", "model": "claude-haiku-4-5", "candidate": {"type": "index", "params": {"table": "cast_info", "columns": ["person_id", "movie_id"]}, "reversible": true}, "proposer_reasoning": "The cast_info table (300k rows, no secondary indexes) is a natural join point for filtering by actor/person or movie. A composite index on (person_id, movie_id) will accelerate common OLTP queries that filter or join on either column, particularly for queries like \"find all movies for a person\" or \"find cast for a movie\" without seq-scanning the full 300k rows.", "pore": "auto_safe", "risk_level": "low", "escalated": false, "human_judge": null, "human_decision": null, "human_rationale": null, "baseline_p99": 48.731, "candidate_p99": 48.731, "within_noise": false, "decision": "keep", "proposer_tokens": {"input_tokens": 1376, "output_tokens": 191}, "human_tokens": {}}
{"style": "stationary", "iteration": 2, "drift": 0.15, "regime": "calm", "model": "claude-haiku-4-5", "candidate": {"type": "index", "params": {"table": "movie_keyword", "columns": ["keyword_id", "movie_id"]}, "reversible": true}, "proposer_reasoning": "The workload is read-heavy OLTP with stable patterns. After the production_year index on title, the next common bottleneck in this schema is JOIN queries between movie_keyword and keyword (e.g., filtering/aggregating by keyword on titles). An index on (keyword_id, movie_id) will accelerate lookups and joins on that critical path, exploiting the calm regime where reversible, targeted fixes are proven effective.", "pore": "auto_safe", "risk_level": "low", "escalated": false, "human_judge": null, "human_decision": null, "human_rationale": null, "baseline_p99": 31.207, "candidate_p99": 31.207, "within_noise": false, "decision": "keep", "proposer_tokens": {"input_tokens": 1404, "output_tokens": 197}, "human_tokens": {}}
{"style": "stationary", "iteration": 3, "drift": 0.15, "regime": "calm", "model": "claude-haiku-4-5", "candidate": {"type": "index", "params": {"table": "cast_info", "columns": ["movie_id", "role_id"]}, "reversible": true}, "proposer_reasoning": "The cast_info table (300k rows) lacks an index on role_id, a common filter/join column. This secondary index will accelerate queries filtering or joining on role_id while avoiding sequential scans, complementing the existing person_id/movie_id compound index for a well-rounded index strategy on the join-heavy table.", "pore": "auto_safe", "risk_level": "low", "escalated": false, "human_judge": null, "human_decision": null, "human_rationale": null, "baseline_p99": 20.452, "candidate_p99": 20.452, "within_noise": false, "decision": "keep", "proposer_tokens": {"input_tokens": 1432, "output_tokens": 175}, "human_tokens": {}}
{"style": "stationary", "iteration": 4, "drift": 0.15, "regime": "calm", "model": "claude-haiku-4-5", "candidate": {"type": "index", "params": {"table": "title", "columns": ["kind_id", "production_year"]}, "reversible": true}, "proposer_reasoning": "The workload is stable and read-heavy with a known bottleneck. A composite index on (kind_id, production_year) will support both filtering and likely common join/filter patterns on title, enabling index-only scans or faster index access when queries filter by kind_id alongside the production_year range. This is a low-risk, reversible addition that directly targets the identified bottleneck without disrupting existing indexes or requiring systemic changes.", "pore": "auto_safe", "risk_level": "low", "escalated": false, "human_judge": null, "human_decision": null, "human_rationale": null, "baseline_p99": 12.917, "candidate_p99": 12.917, "within_noise": false, "decision": "keep", "proposer_tokens": {"input_tokens": 1460, "output_tokens": 197}, "human_tokens": {}}
{"style": "stationary", "iteration": 5, "drift": 0.15, "regime": "calm", "model": "claude-haiku-4-5", "candidate": {"type": "index", "params": {"table": "cast_info", "columns": ["movie_id", "person_id"]}, "reversible": true}, "proposer_reasoning": "The existing index on (person_id, movie_id) is optimized for lookups starting with person_id, but common join patterns and filtering likely start from movie_id (title joins cast_info on movie_id). Reversing the column order to (movie_id, person_id) enables efficient index-driven lookups when movie_id is the leading filter, reducing sequential scans and improving p99 latency for the read-heavy OLTP workload.", "pore": "auto_safe", "risk_level": "low", "escalated": false, "human_judge": null, "human_decision": null, "human_rationale": null, "baseline_p99": 8.333, "candidate_p99": 8.333, "within_noise": false, "decision": "keep", "proposer_tokens": {"input_tokens": 1486, "output_tokens": 211}, "human_tokens": {}}
{"style": "stationary", "iteration": 6, "drift": 0.15, "regime": "calm", "model": "claude-haiku-4-5", "candidate": {"type": "index", "params": {"table": "title", "columns": ["kind_id", "production_year"]}, "reversible": true}, "proposer_reasoning": "The workload shows a stable, read-heavy OLTP pattern with a clear bottleneck: the query `SELECT * FROM title WHERE production_year BETWEEN 2000 AND 2010` is performing a seq scan despite a single-column index on production_year already being in place. A composite index on (kind_id, production_year) is ideal here because it allows the planner to eliminate seq scans for queries that filter or join on both columns—a common pattern in schema exploration workloads. This is reversible, targeted, and addresses the exact class of queries causing the p99 latency spike.", "pore": "auto_safe", "risk_level": "low", "escalated": false, "human_judge": null, "human_decision": null, "human_rationale": null, "baseline_p99": 5.475, "candidate_p99": 5.475, "within_noise": false, "decision": "keep", "proposer_tokens": {"input_tokens": 1514, "output_tokens": 249}, "human_tokens": {}}
{"style": "stationary", "iteration": 7, "drift": 0.15, "regime": "calm", "model": "claude-haiku-4-5", "candidate": {"type": "index", "params": {"table": "cast_info", "columns": ["movie_id"]}, "reversible": true}, "proposer_reasoning": "The cast_info table (~300k rows) likely participates in join-heavy queries filtering on title.production_year. A single-column index on movie_id will accelerate the most common join path without redundancy, since existing composite indexes on cast_info already cover most filter+join scenarios but a dedicated movie_id index ensures fast lookups when cast_info is the driving table.", "pore": "auto_safe", "risk_level": "low", "escalated": false, "human_judge": null, "human_decision": null, "human_rationale": null, "baseline_p99": 3.639, "candidate_p99": 3.639, "within_noise": false, "decision": "keep", "proposer_tokens": {"input_tokens": 1540, "output_tokens": 186}, "human_tokens": {}}
{"style": "stationary", "iteration": 8, "drift": 0.15, "regime": "calm", "model": "claude-haiku-4-5", "candidate": {"type": "statistics", "params": {"table": "title", "columns": ["kind_id", "production_year"]}, "reversible": true}, "proposer_reasoning": "Extended statistics on (kind_id, production_year) will improve cardinality estimation for correlated filter/join patterns. The existing single-column index on production_year and compound index on (kind_id, production_year) are already in place; statistics will refine the planner's decisions when both columns are filtered, reducing seq scans in related queries.", "pore": "auto_safe", "risk_level": "low", "escalated": false, "human_judge": null, "human_decision": null, "human_rationale": null, "baseline_p99": 3.639, "candidate_p99": 3.447, "within_noise": true, "decision": "discard", "proposer_tokens": {"input_tokens": 1562, "output_tokens": 193}, "human_tokens": {}}
{"style": "stationary", "iteration": 9, "drift": 0.15, "regime": "calm", "model": "claude-haiku-4-5", "candidate": {"type": "index", "params": {"table": "cast_info", "columns": ["movie_id", "role_id", "person_id"]}, "reversible": true}, "proposer_reasoning": "The cast_info table (~300k rows) lacks a covering index that includes both role_id and person_id alongside movie_id. This enables index-only scans for common joins and filters on role_id, eliminating heap lookups and reducing p99 latency on read-heavy OLTP queries that filter or aggregate by role or person within a movie context.", "pore": "auto_safe", "risk_level": "low", "escalated": false, "human_judge": null, "human_decision": null, "human_rationale": null, "baseline_p99": 2.335, "candidate_p99": 2.335, "within_noise": false, "decision": "keep", "proposer_tokens": {"input_tokens": 1562, "output_tokens": 187}, "human_tokens": {}}
{"style": "stationary", "iteration": 10, "drift": 0.15, "regime": "calm", "model": "claude-haiku-4-5", "candidate": {"type": "statistics", "params": {"table": "title", "columns": ["kind_id", "production_year"]}, "reversible": true}, "proposer_reasoning": "The workload shows a read-heavy pattern filtering/joining on kind_id and production_year together. Extended statistics on these correlated columns will improve the cardinality estimates for queries filtering or joining on both, allowing the planner to choose optimal index access paths and join strategies instead of relying on independence assumptions that are likely violated here.", "pore": "auto_safe", "risk_level": "low", "escalated": false, "human_judge": null, "human_decision": null, "human_rationale": null, "baseline_p99": 2.335, "candidate_p99": 2.222, "within_noise": true, "decision": "discard", "proposer_tokens": {"input_tokens": 1596, "output_tokens": 186}, "human_tokens": {}}
{"style": "stationary", "iteration": 11, "drift": 0.15, "regime": "calm", "model": "claude-haiku-4-5", "candidate": {"type": "index", "params": {"table": "cast_info", "columns": ["movie_id", "nr_order"]}, "reversible": true}, "proposer_reasoning": "The cast_info table (~300k rows) lacks an index on nr_order, which is commonly used in queries ordering cast lists. An index on (movie_id, nr_order) enables efficient retrieval of ordered cast members per movie, complementing the existing movie_id indexes and directly supporting typical OLTP patterns on this large table.", "pore": "auto_safe", "risk_level": "low", "escalated": false, "human_judge": null, "human_decision": null, "human_rationale": null, "baseline_p99": 1.53, "candidate_p99": 1.53, "within_noise": false, "decision": "keep", "proposer_tokens": {"input_tokens": 1596, "output_tokens": 181}, "human_tokens": {}}
{"style": "stationary", "iteration": 12, "drift": 0.15, "regime": "calm", "model": "claude-haiku-4-5", "candidate": {"type": "statistics", "params": {"table": "title", "columns": ["kind_id", "production_year"]}, "reversible": true}, "proposer_reasoning": "An index on (kind_id, production_year) already exists, but the planner may lack correlation statistics between these columns. Extended statistics will improve selectivity estimation for queries filtering on production_year, especially those also joined via kind_id, reducing unnecessary seq scans and improving p99 latency in this stable, read-heavy workload.", "pore": "auto_safe", "risk_level": "low", "escalated": false, "human_judge": null, "human_decision": null, "human_rationale": null, "baseline_p99": 1.53, "candidate_p99": 1.451, "within_noise": true, "decision": "discard", "proposer_tokens": {"input_tokens": 1624, "output_tokens": 178}, "human_tokens": {}}
{"style": "stationary", "iteration": 13, "drift": 0.15, "regime": "calm", "model": "claude-haiku-4-5", "candidate": {"type": "index", "params": {"table": "cast_info", "columns": ["person_id", "movie_id", "role_id", "nr_order"]}, "reversible": true}, "proposer_reasoning": "The schema has 300k cast_info rows with no compound indexes that cover all four critical access columns together. Creating a covering index on (person_id, movie_id, role_id, nr_order) will enable index-only scans for queries joining or filtering on person_id while projecting movie_id, role_id, and nr_order, eliminating heap lookups and reducing p99 latency on hot cast_info queries in this read-heavy OLTP workload.", "pore": "auto_safe", "risk_level": "low", "escalated": false, "human_judge": null, "human_decision": null, "human_rationale": null, "baseline_p99": 1.0, "candidate_p99": 1.0, "within_noise": false, "decision": "keep", "proposer_tokens": {"input_tokens": 1624, "output_tokens": 219}, "human_tokens": {}}
{"style": "stationary", "iteration": 14, "drift": 0.15, "regime": "calm", "model": "claude-haiku-4-5", "candidate": {"type": "statistics", "params": {"table": "title", "columns": ["kind_id", "production_year"]}, "reversible": true}, "proposer_reasoning": "An index on (kind_id, production_year) already exists. Extended statistics on these two correlated columns will help the planner accurately estimate selectivity for multi-column WHERE and JOIN predicates involving both columns, improving cardinality estimates and preventing inefficient plan choices on subsequent queries that filter or join on both dimensions.", "pore": "auto_safe", "risk_level": "low", "escalated": false, "human_judge": null, "human_decision": null, "human_rationale": null, "baseline_p99": 1.0, "candidate_p99": 1.0, "within_noise": true, "decision": "discard", "proposer_tokens": {"input_tokens": 1664, "output_tokens": 183}, "human_tokens": {}}
{"style": "stationary", "iteration": 15, "drift": 0.15, "regime": "calm", "model": "claude-haiku-4-5", "candidate": {"type": "statistics", "params": {"table": "title", "columns": ["kind_id", "production_year"]}, "reversible": true}, "proposer_reasoning": "Extended statistics on (kind_id, production_year) will improve cardinality estimation for correlated queries filtering on both columns, reducing optimizer uncertainty and enabling better plan selection for p99 latency on joins and range queries in the stable OLTP workload.", "pore": "auto_safe", "risk_level": "low", "escalated": false, "human_judge": null, "human_decision": null, "human_rationale": null, "baseline_p99": 1.0, "candidate_p99": 1.007, "within_noise": true, "decision": "rollback", "proposer_tokens": {"input_tokens": 1664, "output_tokens": 171}, "human_tokens": {}}
{"style": "stationary", "iteration": 16, "drift": 0.15, "regime": "calm", "model": "claude-haiku-4-5", "candidate": {"type": "statistics", "params": {"table": "title", "columns": ["kind_id", "production_year"]}, "reversible": true}, "proposer_reasoning": "The workload is read-heavy and stable; an index on production_year alone already exists. Extended statistics on the (kind_id, production_year) pair will refine the planner's cardinality estimates for queries filtering on both columns or on production_year within kind-specific result sets, improving plan quality without additional I/O overhead.", "pore": "auto_safe", "risk_level": "low", "escalated": false, "human_judge": null, "human_decision": null, "human_rationale": null, "baseline_p99": 1.0, "candidate_p99": 1.0, "within_noise": true, "decision": "discard", "proposer_tokens": {"input_tokens": 1664, "output_tokens": 189}, "human_tokens": {}}
{"style": "stationary", "iteration": 17, "drift": 0.15, "regime": "calm", "model": "claude-haiku-4-5", "candidate": {"type": "index", "params": {"table": "title", "columns": ["production_year", "id"]}, "reversible": true}, "proposer_reasoning": "The existing single-column index on production_year forces a table lookup for the SELECT * query. Adding id to the index creates a covering index that eliminates the heap access entirely, reducing p99 latency for this stable, read-heavy workload.", "pore": "auto_safe", "risk_level": "low", "escalated": false, "human_judge": null, "human_decision": null, "human_rationale": null, "baseline_p99": 1.0, "candidate_p99": 1.0, "within_noise": true, "decision": "discard", "proposer_tokens": {"input_tokens": 1664, "output_tokens": 152}, "human_tokens": {}}
{"style": "stationary", "iteration": 18, "drift": 0.15, "regime": "calm", "model": "claude-haiku-4-5", "candidate": {"type": "index", "params": {"table": "title", "columns": ["production_year", "id"]}, "reversible": true}, "proposer_reasoning": "The workload has a seq scan on `SELECT * FROM title WHERE production_year BETWEEN 2000 AND 2010`. Although a single-column index on `production_year` exists, adding `id` (or the full row via INCLUDE) as a covering column enables an index-only scan, eliminating heap lookups entirely and delivering the fastest possible latency for this high-frequency query.", "pore": "auto_safe", "risk_level": "low", "escalated": false, "human_judge": null, "human_decision": null, "human_rationale": null, "baseline_p99": 1.0, "candidate_p99": 1.0, "within_noise": true, "decision": "discard", "proposer_tokens": {"input_tokens": 1664, "output_tokens": 191}, "human_tokens": {}}
{"style": "stationary", "iteration": 19, "drift": 0.15, "regime": "calm", "model": "claude-haiku-4-5", "candidate": {"type": "index", "params": {"table": "title", "columns": ["production_year", "id"]}, "reversible": true}, "proposer_reasoning": "The workload's primary bottleneck is a sequential scan on `title WHERE production_year BETWEEN 2000 AND 2010`. While a simple index on `production_year` exists, including `id` (the primary key) in the index enables a full covering index scan that eliminates heap lookups entirely, drastically reducing p99 latency for this common range query.", "pore": "auto_safe", "risk_level": "low", "escalated": false, "human_judge": null, "human_decision": null, "human_rationale": null, "baseline_p99": 1.0, "candidate_p99": 1.0, "within_noise": true, "decision": "discard", "proposer_tokens": {"input_tokens": 1664, "output_tokens": 181}, "human_tokens": {}}
{"style": "stationary", "iteration": 20, "drift": 0.15, "regime": "calm", "model": "claude-haiku-4-5", "candidate": {"type": "statistics", "params": {"table": "title", "columns": ["kind_id", "production_year"]}, "reversible": true}, "proposer_reasoning": "An index on (kind_id, production_year) already exists, but the planner may lack statistics on their correlation to choose it effectively for BETWEEN filters on production_year alone. Extended statistics will improve cardinality estimation for selective range queries on production_year, enabling the optimizer to skip seq scans even when kind_id isn't filtered.", "pore": "auto_safe", "risk_level": "low", "escalated": false, "human_judge": null, "human_decision": null, "human_rationale": null, "baseline_p99": 1.0, "candidate_p99": 1.0, "within_noise": true, "decision": "discard", "proposer_tokens": {"input_tokens": 1664, "output_tokens": 178}, "human_tokens": {}}
{"style": "stationary", "iteration": 21, "drift": 0.15, "regime": "calm", "model": "claude-haiku-4-5", "candidate": {"type": "index", "params": {"table": "title", "columns": ["production_year"]}, "reversible": true}, "proposer_reasoning": "The workload problem is a sequential scan on the title table for a BETWEEN filter on production_year. An index on production_year alone will enable fast range scans for this query pattern, directly addressing the bottleneck in a calm, stable regime where a simple, targeted fix is appropriate.", "pore": "auto_safe", "risk_level": "low", "escalated": false, "human_judge": null, "human_decision": null, "human_rationale": null, "baseline_p99": 1.0, "candidate_p99": 1.0, "within_noise": true, "decision": "discard", "proposer_tokens": {"input_tokens": 1664, "output_tokens": 157}, "human_tokens": {}}
{"style": "stationary", "iteration": 22, "drift": 0.15, "regime": "calm", "model": "claude-haiku-4-5", "candidate": {"type": "index", "params": {"table": "cast_info", "columns": ["movie_id", "nr_order", "person_id"]}, "reversible": true}, "proposer_reasoning": "The existing indexes on cast_info are heavily weighted toward (movie_id, role_id, person_id) and (movie_id, nr_order), but no single index yet covers the exact combination (movie_id, nr_order, person_id) in that order. This ordering is optimal for join-filtered queries that select on movie_id first, then narrow by nr_order, then retrieve person_id—a common OLTP access pattern on cast_info. This targeted three-column index will eliminate any remaining sequential scans on cast_info for typical role-ordering and cast-list queries without duplicate coverage.", "pore": "auto_safe", "risk_level": "low", "escalated": false, "human_judge": null, "human_decision": null, "human_rationale": null, "baseline_p99": 1.0, "candidate_p99": 1.0, "within_noise": true, "decision": "discard", "proposer_tokens": {"input_tokens": 1664, "output_tokens": 247}, "human_tokens": {}}
