{"style": "accel_creep", "iteration": 15, "drift": 0.4253, "regime": "shifting", "model": "claude-haiku-4-5", "candidate": {"type": "statistics", "params": {"table": "title", "columns": ["production_year", "kind_id"]}, "reversible": true}, "proposer_reasoning": "The problem query filters on production_year (2000-2010) and joins to cast_info; the bad row-count estimate suggests the planner doesn't understand the correlation between production_year and the number of cast members per movie. Extended statistics on production_year and kind_id will capture how these often-filtered columns co-vary, improving selectivity estimates for both the WHERE clause and the JOIN cardinality in this and similar analytical queries.", "pore": "auto_safe", "risk_level": "low", "escalated": false, "human_judge": null, "human_decision": null, "human_rationale": null, "baseline_p99": 1.0, "candidate_p99": 1.0, "within_noise": true, "decision": "discard", "proposer_tokens": {"input_tokens": 1672, "output_tokens": 210}, "human_tokens": {}}
{"style": "accel_creep", "iteration": 16, "drift": 0.4839, "regime": "shifting", "model": "claude-haiku-4-5", "candidate": {"type": "statistics", "params": {"table": "title", "columns": ["production_year", "id"]}, "reversible": true}, "proposer_reasoning": "The problem query filters on production_year then joins to cast_info on t.id. Extended statistics on (production_year, id) will capture the correlation between these columns and improve rowcount estimates at the filter boundary, reducing plan instability as the workload drifts. This directly addresses the stated \"bad rowcount estimates\" without additional I/O overhead.", "pore": "auto_safe", "risk_level": "low", "escalated": false, "human_judge": null, "human_decision": null, "human_rationale": null, "baseline_p99": 1.0, "candidate_p99": 1.026, "within_noise": true, "decision": "rollback", "proposer_tokens": {"input_tokens": 1672, "output_tokens": 179}, "human_tokens": {}}
{"style": "accel_creep", "iteration": 17, "drift": 0.5463, "regime": "shifting", "model": "claude-haiku-4-5", "candidate": {"type": "statistics", "params": {"table": "title", "columns": ["production_year", "id"]}, "reversible": true}, "proposer_reasoning": "The problem query filters title by production_year (a range predicate) then joins to cast_info. Bad row-count estimates on the filtered title set directly propagate to misplanning the join. Extended statistics on (production_year, id) will help the planner understand the correlation between the filter and the join key, improving cardinality estimation for the join itself.", "pore": "auto_safe", "risk_level": "low", "escalated": false, "human_judge": null, "human_decision": null, "human_rationale": null, "baseline_p99": 1.0, "candidate_p99": 1.0, "within_noise": true, "decision": "discard", "proposer_tokens": {"input_tokens": 1672, "output_tokens": 192}, "human_tokens": {}}
{"style": "accel_creep", "iteration": 18, "drift": 0.6125, "regime": "turbulent", "model": "claude-haiku-4-5", "candidate": {"type": "guc", "params": {"name": "work_mem", "value": "256MB"}, "reversible": true}, "proposer_reasoning": "Hash join spilling under concurrent write-heavy bursts is the immediate p99 killer. Raising work_mem from its likely default (4MB) to 256MB will keep hash tables in-memory for most join operations in this workload, eliminating disk I/O during sorts and hash aggregates without reshaping global concurrency or requiring service bounce.", "pore": "auto_safe", "risk_level": "low", "escalated": false, "human_judge": null, "human_decision": null, "human_rationale": null, "baseline_p99": 1.0, "candidate_p99": 1.0, "within_noise": true, "decision": "discard", "proposer_tokens": {"input_tokens": 1678, "output_tokens": 173}, "human_tokens": {}}
{"style": "accel_creep", "iteration": 19, "drift": 0.6824, "regime": "turbulent", "model": "claude-haiku-4-5", "candidate": {"type": "guc", "params": {"name": "jit", "value": "off"}, "reversible": true}, "proposer_reasoning": "Under heavy concurrent write bursts with plan regressions on 5-table joins, JIT compilation is likely adding non-deterministic overhead and memory pressure without benefit for short-lived execution plans that flip between runs. Disabling JIT eliminates compilation latency variance and frees memory for buffer cache and work_mem, stabilizing p99 in this turbulent regime.", "pore": "auto_safe", "risk_level": "low", "escalated": false, "human_judge": null, "human_decision": null, "human_rationale": null, "baseline_p99": 1.0, "candidate_p99": 1.042, "within_noise": true, "decision": "rollback", "proposer_tokens": {"input_tokens": 1678, "output_tokens": 181}, "human_tokens": {}}
{"style": "accel_creep", "iteration": 20, "drift": 0.7561, "regime": "turbulent", "model": "claude-haiku-4-5", "candidate": {"type": "guc", "params": {"name": "random_page_cost", "value": "1.1"}, "reversible": true}, "proposer_reasoning": "Plan regressions on multi-table joins under write-heavy turbulence stem from the planner's outdated cost model defaulting to disk-bound assumptions (random_page_cost=4.0). Lowering it to 1.1 makes nested-loop and index-based plans cheaper relative to hash joins; this reduces spill-to-disk during plan flips and stabilizes execution under connection churn without reshaping every session's semantics.", "pore": "auto_safe", "risk_level": "low", "escalated": false, "human_judge": null, "human_decision": null, "human_rationale": null, "baseline_p99": 1.0, "candidate_p99": 1.0, "within_noise": true, "decision": "discard", "proposer_tokens": {"input_tokens": 1678, "output_tokens": 205}, "human_tokens": {}}
{"style": "accel_creep", "iteration": 21, "drift": 0.8336, "regime": "turbulent", "model": "claude-haiku-4-5", "candidate": {"type": "guc", "params": {"name": "join_collapse_limit", "value": "4"}, "reversible": true}, "proposer_reasoning": "Under turbulent drift with plan flips on 5-table joins, the planner's greedy search over exponential join orders is destabilizing. Lowering join_collapse_limit from default 8 to 4 forces GEQO (genetic query optimizer) earlier, providing more stable plans and preventing spill-prone hash join cascades when the greedy approach diverges. This directly addresses plan regression without reshaping session behavior globally.", "pore": "auto_safe", "risk_level": "low", "escalated": false, "human_judge": null, "human_decision": null, "human_rationale": null, "baseline_p99": 1.0, "candidate_p99": 1.0, "within_noise": true, "decision": "discard", "proposer_tokens": {"input_tokens": 1678, "output_tokens": 200}, "human_tokens": {}}
{"style": "accel_creep", "iteration": 22, "drift": 0.9149, "regime": "regime_break", "model": "claude-haiku-4-5", "candidate": {"type": "guc", "params": {"name": "synchronous_commit", "value": "off"}, "reversible": true}, "proposer_reasoning": "Under regime_break with a 10x p99 spike and mixed OLTP+OLAP workload, the dominant bottleneck is almost certainly WAL synchronous I/O blocking the bulk inserts, which then cascade lock contention onto the join queries. Disabling synchronous_commit eliminates this hard sync barrier and allows inserts to complete orders of magnitude faster, dramatically reducing lock hold times and query queuing. This is reversible and immediately effective for this specific regime pathology.", "pore": "blast_radius", "risk_level": "high", "escalated": true, "human_judge": "claude-sonnet-4-6", "human_decision": "approve", "human_rationale": "This is a reversible GUC change (synchronous_commit = off) that can be reverted in seconds with a single SET command or config reload, making the blast radius manageable despite the high-risk flag. The operating context is critical: drift=0.91 signals an unprecedented workload regime with p99 latency spiking ~10x, targeted index work has already been exhausted, and there is active system degradation. Disabling synchronous commit trades a narrow, well-understood durability risk (loss of the last few transactions — typically <1 WAL writer cycle, ~200ms — in the event of a hard crash) for a potentially large write-latency reduction, since clients no longer block waiting for WAL flush confirmation. This is a well-established PostgreSQL performance lever and its failure mode is bounded and documented: it is NOT a data-corruption risk, only a small recent-transaction loss risk on crash. Given that (a) the system is already bleeding badly and user-facing SLOs are almost certainly violated, (b) the change is immediately reversible with zero downtime, (c) the durability trade-off is narrow and acceptable for most OLTP workloads under emergency conditions, and (d) no irreversible structural changes (schema, data) are involved, the expected benefit clearly outweighs the risk. Operator must: (1) alert the application/data-owner team of the temporary durability relaxation, (2) monitor whether p99 recovers within 5–10 minutes, and (3) revert or escalate to a proper fix (connection pooling, query plan intervention, hardware scaling) as soon as the incident is stabilized. Do not leave this setting permanently off without a formal risk sign-off.", "baseline_p99": null, "candidate_p99": null, "within_noise": null, "decision": "escalated", "proposer_tokens": {"input_tokens": 1738, "output_tokens": 203}, "human_tokens": {"input_tokens": 981, "output_tokens": 430}}
{"style": "accel_creep", "iteration": 23, "drift": 1.0, "regime": "regime_break", "model": "claude-haiku-4-5", "candidate": {"type": "guc", "params": {"name": "shared_buffers", "value": "2GB"}, "reversible": true}, "proposer_reasoning": "The OLTP+OLAP storm with 5-table joins on a ~300k-row cast_info table is thrashing the buffer pool under mixed read-write load. Increasing shared_buffers (assuming typical Linux config with ~10–20GB RAM) reduces eviction pressure and stabilizes page residency for the hot working set, directly attacking the root cause of the 10x p99 oscillation without sacrificing durability guarantees.", "pore": "blast_radius", "risk_level": "high", "escalated": true, "human_judge": "claude-sonnet-4-6", "human_decision": "approve", "human_rationale": "This is a GUC (Grand Unified Configuration) change to `shared_buffers`, which is one of the most well-understood and high-leverage PostgreSQL tuning knobs available. The proposed value of 2GB is a canonical, conservative recommendation (typically 25% of system RAM for a dedicated DB server), and the change is reversible — it requires a PostgreSQL reload/restart but can be reverted instantly by resetting the parameter. The blast radius concern is valid because a misconfigured `shared_buffers` can cause OOM conditions or degrade performance if RAM is overcommitted, but 2GB is a modest, widely-accepted baseline, not an aggressive value. Given the regime_break context — a workload with no historical precedent causing p99 latency spikes of ~10x, where targeted index changes have already been tried and failed — the most likely systemic cause is excessive buffer cache pressure or I/O bottlenecking due to insufficient shared memory. Increasing `shared_buffers` directly addresses this class of problem at the storage-layer cache level and is the correct next escalation after index tuning is exhausted. The high drift (1.00) warrants caution, but the reversibility of this change, the well-understood semantics of the parameter, and the severity of the ongoing incident together justify acting decisively. Approving, with the strong caveat that the on-call engineer must (1) confirm available system RAM headroom before applying to avoid OOM, (2) monitor buffer hit ratio and memory utilization immediately post-change, and (3) have a rollback command staged and ready.", "baseline_p99": null, "candidate_p99": null, "within_noise": null, "decision": "escalated", "proposer_tokens": {"input_tokens": 1795, "output_tokens": 215}, "human_tokens": {"input_tokens": 981, "output_tokens": 400}}
