{"style": "oscillating", "iteration": 2, "drift": 0.8464, "regime": "turbulent", "model": "claude-haiku-4-5", "candidate": {"type": "guc", "params": {"name": "random_page_cost", "value": "1.1"}, "reversible": true}, "proposer_reasoning": "Under write-heavy bursts with plan regressions on multi-table joins, the planner is likely over-favoring nested-loop plans due to default random_page_cost=4.0, causing hash-join spill and inconsistent plans. Lowering to 1.1 makes sequential scan + hash join more attractive relative to index seeks under memory pressure, stabilizing plans across volatile workloads and reducing costly spills on the 5-table join.", "pore": "auto_safe", "risk_level": "low", "escalated": false, "human_judge": null, "human_decision": null, "human_rationale": null, "baseline_p99": 97.853, "candidate_p99": 97.853, "within_noise": false, "decision": "keep", "proposer_tokens": {"input_tokens": 1441, "output_tokens": 207}, "human_tokens": {}}
{"style": "oscillating", "iteration": 3, "drift": 0.9, "regime": "regime_break", "model": "claude-haiku-4-5", "candidate": {"type": "guc", "params": {"name": "synchronous_commit", "value": "off"}, "reversible": true}, "proposer_reasoning": "In a regime_break with 10x p99 spike driven by mixed OLTP+OLAP and bulk inserts, synchronous_commit=off removes the commit latency bottleneck that stalls on WAL fsync, allowing write-heavy workloads to return immediately. This is the highest-leverage systemic lever available: it trades durability guarantee for throughput when a mixed storm is oscillating p99 wildly (80–900ms). Safe to flip back if stability criteria shift.", "pore": "blast_radius", "risk_level": "high", "escalated": true, "human_judge": "claude-sonnet-4-6", "human_decision": "approve", "human_rationale": "Context and tradeoffs carefully weighed: We are in a confirmed regime_break (drift=0.90) with p99 latency spiking ~10x above baseline, targeted indexing has already been attempted and failed to stem the bleeding, and there is a genuine systemic crisis. The proposed change — setting synchronous_commit=off — is a well-understood PostgreSQL GUC that trades strict per-transaction durability for dramatically reduced write latency and WAL flush pressure. Critically, it is REVERSIBLE (can be toggled back to 'on' in seconds with a single SET command, no restart required, no data migration), so the blast radius, while real, is bounded and escapable. The durability risk is narrow and well-defined: in the event of a hard crash between commit acknowledgment and WAL flush (~few-milliseconds window), the last handful of committed transactions could be lost — data is NOT corrupted, the database remains consistent, only a small recency window of writes is at risk. This risk is acceptable as an emergency, time-limited measure given the alternative is continued p99 degradation at 10x that is actively impacting users right now. The change should be applied at the session or database level (not globally if possible), monitored closely, and reverted as soon as the workload stabilizes or a durable fix is identified. An incident note must be logged immediately documenting the window during which synchronous_commit=off is active, so that any post-incident data reconciliation is scoped correctly. Do NOT leave this in place beyond the immediate crisis window — schedule a mandatory review and revert within 4 hours or at the next stable performance plateau, whichever comes first.", "baseline_p99": null, "candidate_p99": null, "within_noise": null, "decision": "escalated", "proposer_tokens": {"input_tokens": 1525, "output_tokens": 231}, "human_tokens": {"input_tokens": 981, "output_tokens": 417}}
{"style": "oscillating", "iteration": 4, "drift": 0.8464, "regime": "turbulent", "model": "claude-haiku-4-5", "candidate": {"type": "guc", "params": {"name": "jit", "value": "off"}, "reversible": true}, "proposer_reasoning": "Under write-heavy bursts with plan regressions on 5-table joins, JIT compilation overhead is amplifying latency variance and cache-coherency pressure. Disabling JIT trades steady-state throughput for stable p99 predictability under connection churn, and is instantly reversible if telemetry shows it was wrong.", "pore": "auto_safe", "risk_level": "low", "escalated": false, "human_judge": null, "human_decision": null, "human_rationale": null, "baseline_p99": 89.676, "candidate_p99": 89.676, "within_noise": false, "decision": "keep", "proposer_tokens": {"input_tokens": 1522, "output_tokens": 168}, "human_tokens": {}}
{"style": "oscillating", "iteration": 5, "drift": 0.7, "regime": "turbulent", "model": "claude-haiku-4-5", "candidate": {"type": "statistics", "params": {"table": "cast_info", "columns": ["person_id", "movie_id"]}, "reversible": true}, "proposer_reasoning": "Under write-heavy bursts with connection churn and plan regressions on the 5-table join, the planner is likely misestimating cardinality for the cast_info filters (person_id and movie_id are the join keys to title and name). Extended statistics on these correlated columns will sharpen selectivity estimates and stabilize join order decisions without reshaping session behaviour or bouncing the service.", "pore": "auto_safe", "risk_level": "low", "escalated": false, "human_judge": null, "human_decision": null, "human_rationale": null, "baseline_p99": 89.676, "candidate_p99": 91.852, "within_noise": true, "decision": "rollback", "proposer_tokens": {"input_tokens": 1542, "output_tokens": 195}, "human_tokens": {}}
{"style": "oscillating", "iteration": 6, "drift": 0.5, "regime": "shifting", "model": "claude-haiku-4-5", "candidate": {"type": "statistics", "params": {"table": "cast_info", "columns": ["movie_id", "person_id"]}, "reversible": true}, "proposer_reasoning": "The join between title and cast_info on t.id = ci.movie_id is the critical cardinality estimation problem. Extended statistics on cast_info(movie_id, person_id) will help the planner understand the distribution of movie references and whether person_id correlates with movie selectivity, improving join cardinality estimates without requiring indexes.", "pore": "auto_safe", "risk_level": "low", "escalated": false, "human_judge": null, "human_decision": null, "human_rationale": null, "baseline_p99": 89.676, "candidate_p99": 87.266, "within_noise": true, "decision": "discard", "proposer_tokens": {"input_tokens": 1536, "output_tokens": 193}, "human_tokens": {}}
{"style": "oscillating", "iteration": 7, "drift": 0.3, "regime": "shifting", "model": "claude-haiku-4-5", "candidate": {"type": "index", "params": {"table": "cast_info", "columns": ["movie_id"]}, "reversible": true}, "proposer_reasoning": "The query's worst bottleneck is the join on cast_info.movie_id—with ~300k rows and no secondary indexes, the planner cannot estimate how many cast_info rows match each title's id. An index on cast_info(movie_id) enables efficient nested-loop or index-based plans and drastically improves cardinality estimates for the join, reducing the row-count estimation error that is currently causing plan flips under the shifting workload.", "pore": "auto_safe", "risk_level": "low", "escalated": false, "human_judge": null, "human_decision": null, "human_rationale": null, "baseline_p99": 63.186, "candidate_p99": 63.186, "within_noise": false, "decision": "keep", "proposer_tokens": {"input_tokens": 1536, "output_tokens": 202}, "human_tokens": {}}
{"style": "oscillating", "iteration": 8, "drift": 0.1536, "regime": "calm", "model": "claude-haiku-4-5", "candidate": {"type": "index", "params": {"table": "title", "columns": ["production_year"]}, "reversible": true}, "proposer_reasoning": "The problem query is a range scan on production_year with no supporting index, forcing a full table seq scan. A simple B-tree index on this column will allow the planner to use an efficient range index lookup, directly addressing the identified bottleneck in a calm, stable regime where this workload is predictable and repeatable.", "pore": "auto_safe", "risk_level": "low", "escalated": false, "human_judge": null, "human_decision": null, "human_rationale": null, "baseline_p99": 41.206, "candidate_p99": 41.206, "within_noise": false, "decision": "keep", "proposer_tokens": {"input_tokens": 1524, "output_tokens": 180}, "human_tokens": {}}
{"style": "oscillating", "iteration": 9, "drift": 0.1, "regime": "calm", "model": "claude-haiku-4-5", "candidate": {"type": "index", "params": {"table": "movie_keyword", "columns": ["keyword_id", "movie_id"]}, "reversible": true}, "proposer_reasoning": "The workload is read-heavy OLTP with stable patterns. A secondary index on (keyword_id, movie_id) in movie_keyword will accelerate the common join pattern between movie_keyword and keyword, reducing sequential scans when filtering by keyword and then joining to titles. This is a safe, targeted, reversible fix in the familiar territory you described.", "pore": "auto_safe", "risk_level": "low", "escalated": false, "human_judge": null, "human_decision": null, "human_rationale": null, "baseline_p99": 26.706, "candidate_p99": 26.706, "within_noise": false, "decision": "keep", "proposer_tokens": {"input_tokens": 1544, "output_tokens": 179}, "human_tokens": {}}
{"style": "oscillating", "iteration": 10, "drift": 0.1536, "regime": "calm", "model": "claude-haiku-4-5", "candidate": {"type": "index", "params": {"table": "title", "columns": ["production_year", "id"]}, "reversible": true}, "proposer_reasoning": "The workload is hitting a sequential scan on title for range queries on production_year. A covering index on (production_year, id) will enable index-only scans for the SELECT * queries, eliminating heap lookups and reducing p99 latency in this read-heavy, stable regime.", "pore": "auto_safe", "risk_level": "low", "escalated": false, "human_judge": null, "human_decision": null, "human_rationale": null, "baseline_p99": 18.701, "candidate_p99": 18.701, "within_noise": false, "decision": "keep", "proposer_tokens": {"input_tokens": 1572, "output_tokens": 177}, "human_tokens": {}}
{"style": "oscillating", "iteration": 11, "drift": 0.3, "regime": "shifting", "model": "claude-haiku-4-5", "candidate": {"type": "statistics", "params": {"table": "cast_info", "columns": ["movie_id", "nr_order"]}, "reversible": true}, "proposer_reasoning": "The query joins title→cast_info on movie_id and filters on production_year, but the planner lacks correlation statistics between cast_info.movie_id and the selectivity of titles matching the year range. Extended statistics on cast_info(movie_id, nr_order) will help the optimizer understand the distribution of movies in cast_info and improve row-count estimates for the join, reducing plan flips in this drifting analytical workload.", "pore": "auto_safe", "risk_level": "low", "escalated": false, "human_judge": null, "human_decision": null, "human_rationale": null, "baseline_p99": 18.701, "candidate_p99": 17.808, "within_noise": true, "decision": "discard", "proposer_tokens": {"input_tokens": 1630, "output_tokens": 214}, "human_tokens": {}}
{"style": "oscillating", "iteration": 12, "drift": 0.5, "regime": "shifting", "model": "claude-haiku-4-5", "candidate": {"type": "statistics", "params": {"table": "cast_info", "columns": ["movie_id", "person_id"]}, "reversible": true}, "proposer_reasoning": "The query joins title → cast_info on movie_id with a filter on production_year. The planner's row-count estimate for cast_info rows per movie is likely poor because it treats movie_id selectivity and person_id cardinality independently. Extended statistics over these two correlated columns will let the planner better predict how many cast members appear per filtered movie, reducing plan instability under workload drift.", "pore": "auto_safe", "risk_level": "low", "escalated": false, "human_judge": null, "human_decision": null, "human_rationale": null, "baseline_p99": 18.701, "candidate_p99": 18.277, "within_noise": true, "decision": "discard", "proposer_tokens": {"input_tokens": 1630, "output_tokens": 206}, "human_tokens": {}}
{"style": "oscillating", "iteration": 13, "drift": 0.7, "regime": "turbulent", "model": "claude-haiku-4-5", "candidate": {"type": "statistics", "params": {"table": "cast_info", "columns": ["movie_id", "person_id"]}, "reversible": true}, "proposer_reasoning": "Plan regressions on multi-table joins under write-heavy churn indicate the planner is making poor cardinality estimates on the high-cardinality join columns. Extended statistics on cast_info's (movie_id, person_id) will help the planner estimate selectivity when these columns are filtered together—critical for a 5-table join that spills hash joins today.", "pore": "auto_safe", "risk_level": "low", "escalated": false, "human_judge": null, "human_decision": null, "human_rationale": null, "baseline_p99": 18.701, "candidate_p99": 20.057, "within_noise": true, "decision": "rollback", "proposer_tokens": {"input_tokens": 1636, "output_tokens": 200}, "human_tokens": {}}
{"style": "oscillating", "iteration": 14, "drift": 0.8464, "regime": "turbulent", "model": "claude-haiku-4-5", "candidate": {"type": "statistics", "params": {"table": "cast_info", "columns": ["movie_id", "person_id"]}, "reversible": true}, "proposer_reasoning": "Plan regressions on the 5-table join stem from the planner's inability to estimate join selectivity when movie_id and person_id correlate or when their correlation with downstream filtering (keyword, kind_type) is misestimated. Extended statistics on these two columns will reduce join-order thrashing and enable more stable, predictable plans under concurrent write bursts.", "pore": "auto_safe", "risk_level": "low", "escalated": false, "human_judge": null, "human_decision": null, "human_rationale": null, "baseline_p99": 18.701, "candidate_p99": 19.541, "within_noise": true, "decision": "rollback", "proposer_tokens": {"input_tokens": 1636, "output_tokens": 198}, "human_tokens": {}}
{"style": "oscillating", "iteration": 15, "drift": 0.9, "regime": "regime_break", "model": "claude-haiku-4-5", "candidate": {"type": "guc", "params": {"name": "max_wal_size", "value": "4GB"}, "reversible": true}, "proposer_reasoning": "The mixed OLTP+OLAP storm with bulk inserts is likely causing frequent checkpoint storms and WAL thrashing. Increasing max_wal_size delays checkpoints and reduces I/O contention spikes that are amplifying p99 variance (80ms→900ms oscillation). This is safer than synchronous_commit=off because it preserves durability guarantees while smoothing throughput.", "pore": "blast_radius", "risk_level": "high", "escalated": true, "human_judge": "claude-sonnet-4-6", "human_decision": "approve", "human_rationale": "In a regime_break scenario with drift=0.90 and p99 latency spiking ~10x, WAL pressure is a credible systemic bottleneck: an unprecedented workload pattern often means higher-than-normal write amplification, causing frequent WAL-driven checkpoints that generate I/O storms and degrade query latency across the board. Raising max_wal_size from its default (typically 1GB) to 4GB directly addresses this by spacing out checkpoints, reducing checkpoint-induced I/O spikes, and giving the buffer manager more breathing room — a well-understood, textbook mitigation for write-heavy workloads. Critically, this change is a GUC parameter reload (no restart required in modern PostgreSQL), is fully reversible by setting it back at any time, and carries no risk of data loss or corruption — the safety gate's blast_radius=high flag is conservative here because the change is systemic, but the actual downside risk is low: worst case, we consume more disk space for WAL segments temporarily, and we revert. The drift=0.90 and unprecedented workload do raise uncertainty, but the asymmetry strongly favors action: the cost of inaction (sustained p99 ~10x spike bleeding into user experience and potentially cascading) far outweighs the cost of a reversible GUC bump. Targeted indexes have already been tried. This is the right next lever to pull. Approve, with the stipulation that the on-call engineer monitors WAL disk utilization and checkpoint frequency metrics for the next 30 minutes and is ready to revert if disk headroom drops below a safe threshold.", "baseline_p99": null, "candidate_p99": null, "within_noise": null, "decision": "escalated", "proposer_tokens": {"input_tokens": 1696, "output_tokens": 188}, "human_tokens": {"input_tokens": 983, "output_tokens": 412}}
{"style": "oscillating", "iteration": 16, "drift": 0.8464, "regime": "turbulent", "model": "claude-haiku-4-5", "candidate": {"type": "statistics", "params": {"table": "cast_info", "columns": ["movie_id", "person_id"]}, "reversible": true}, "proposer_reasoning": "Plan regressions on multi-table joins indicate the planner lacks correlation statistics between cast_info's foreign keys. Extended statistics on (movie_id, person_id) will help the planner accurately estimate join cardinality, especially under write-heavy churn when stats drift. This avoids service-disruptive GUC changes while directly targeting planner instability.", "pore": "auto_safe", "risk_level": "low", "escalated": false, "human_judge": null, "human_decision": null, "human_rationale": null, "baseline_p99": 18.701, "candidate_p99": 18.098, "within_noise": true, "decision": "discard", "proposer_tokens": {"input_tokens": 1660, "output_tokens": 197}, "human_tokens": {}}
{"style": "oscillating", "iteration": 17, "drift": 0.7, "regime": "turbulent", "model": "claude-haiku-4-5", "candidate": {"type": "statistics", "params": {"table": "cast_info", "columns": ["movie_id", "person_id"]}, "reversible": true}, "proposer_reasoning": "Under write-heavy bursts with plan regressions on multi-table joins, the planner is likely mis-estimating join cardinalities on cast_info's foreign keys. Extended statistics on (movie_id, person_id) will help the planner understand correlation and selectivity during the 5-table join, reducing hash-join spilling and plan flips without requiring service-bouncing GUC changes.", "pore": "auto_safe", "risk_level": "low", "escalated": false, "human_judge": null, "human_decision": null, "human_rationale": null, "baseline_p99": 18.701, "candidate_p99": 19.687, "within_noise": true, "decision": "rollback", "proposer_tokens": {"input_tokens": 1660, "output_tokens": 207}, "human_tokens": {}}
{"style": "oscillating", "iteration": 18, "drift": 0.5, "regime": "shifting", "model": "claude-haiku-4-5", "candidate": {"type": "statistics", "params": {"table": "cast_info", "columns": ["movie_id", "person_id"]}, "reversible": true}, "proposer_reasoning": "The problem query joins title to cast_info; the bad rowcount estimate likely stems from the planner underestimating how many cast_info rows exist per movie. Extended statistics on (movie_id, person_id) will capture the correlation in cast_info's structure and help the planner predict join cardinality more accurately, reducing plan instability under the shifting analytical workload.", "pore": "auto_safe", "risk_level": "low", "escalated": false, "human_judge": null, "human_decision": null, "human_rationale": null, "baseline_p99": 18.701, "candidate_p99": 17.958, "within_noise": true, "decision": "discard", "proposer_tokens": {"input_tokens": 1654, "output_tokens": 199}, "human_tokens": {}}
{"style": "oscillating", "iteration": 19, "drift": 0.3, "regime": "shifting", "model": "claude-haiku-4-5", "candidate": {"type": "statistics", "params": {"table": "cast_info", "columns": ["movie_id", "nr_order"]}, "reversible": true}, "proposer_reasoning": "The query's bad row-count estimate stems from the join between title and cast_info after filtering on production_year. Extended statistics on cast_info(movie_id, nr_order) will help the planner understand the correlation between cast membership and movie identity, improving selectivity estimates for the GROUP BY and join cardinality—especially critical as the workload drifts toward analytical scans where estimate quality directly impacts plan choice.", "pore": "auto_safe", "risk_level": "low", "escalated": false, "human_judge": null, "human_decision": null, "human_rationale": null, "baseline_p99": 18.701, "candidate_p99": 16.867, "within_noise": true, "decision": "discard", "proposer_tokens": {"input_tokens": 1654, "output_tokens": 208}, "human_tokens": {}}
{"style": "oscillating", "iteration": 20, "drift": 0.1536, "regime": "calm", "model": "claude-haiku-4-5", "candidate": {"type": "index", "params": {"table": "title", "columns": ["kind_id", "production_year"]}, "reversible": true}, "proposer_reasoning": "The existing single-column index on production_year handles the basic filter, but many workloads join title to kind_type on kind_id. A covering index on (kind_id, production_year) enables index-only or efficient index-nested-loop scans for queries filtering by production_year while also needing kind information, addressing the most likely remaining bottleneck in this stable, read-heavy OLTP regime.", "pore": "auto_safe", "risk_level": "low", "escalated": false, "human_judge": null, "human_decision": null, "human_rationale": null, "baseline_p99": 12.118, "candidate_p99": 12.118, "within_noise": false, "decision": "keep", "proposer_tokens": {"input_tokens": 1620, "output_tokens": 192}, "human_tokens": {}}
